Sheet: PPClients
A1: NoClient | B1: AdresseEmail | C1: MotDePasse | D1: Nom | E1: Prenom | F1: Rue | G1: Ville | H1: Province | I1: CodePostal | J1: Pays | K1: Tel1 | L1: Tel2 | M1: DateCreation | N1: DateMAJ | O1: NbConnexions | P1: DateDerniereConnexion | Q1: Statut
A2: 10001 | B2: ="client"&RC[-1]&"@gmail.com" -> client10001@gmail.com | C2: 1234 | D2: Solomon | E2: Jason | F2: 1952 Alexis-Nihon Blvd | G2: Saint-Laurent | H2: QC | I2: H4R 3B3 | J2: Canada | K2: (514) 735-8080 | M2: 2019-01-01T00:00:00.000 | O2: 6 | P2: 2019-02-05T00:00:00.000 | Q2: 1
A3: 10002 | B3: ="client"&RC[-1]&"@gmail.com" -> client10002@gmail.com | C3: 1234 | D3: Lowe | E3: Philip | F3: 114 Avenue Duke-of-Kent | G3: Pointe-Claire | H3: QC | I3: H9R 1X9 | J3: Canada | K3: (514) 695-2243 | M3: 2017-02-12T00:00:00.000 | N3: 2018-11-08T00:00:00.000 | O3: 28 | P3: 2019-02-05T00:00:00.000 | Q3: 1
A4: 10003 | B4: ="client"&RC[-1]&"@gmail.com" -> client10003@gmail.com | C4: 1234 | M4: 2016-05-18T00:00:00.000 | N4: 2016-08-08T00:00:00.000 | O4: 15 | P4: 2016-09-04T00:00:00.000 | Q4: 1
A5: 10004 | B5: ="client"&RC[-1]&"@gmail.com" -> client10004@gmail.com | C5: 1234 | D5: Fernandez | E5: Mark | F5: 2014 Rue Richer | G5: Québec | H5: QC | I5: G1V 1P1 | J5: Canada | K5: (418) 425-2353 | L5: (418) 642-3423 | M5: 2018-08-24T00:00:00.000 | N5: 2019-02-02T00:00:00.000 | O5: 86 | P5: 2019-02-06T00:00:00.000 | Q5: 1
A6: 10005 | B6: ="client"&RC[-1]&"@gmail.com" -> client10005@gmail.com | C6: 1234 | M6: 2017-02-11T00:00:00.000 | N6: 2017-12-16T00:00:00.000 | O6: 38 | P6: 2018-01-22T00:00:00.000 | Q6: 1
A7: 10006 | B7: ="client"&RC[-1]&"@gmail.com" -> client10006@gmail.com | C7: 1234 | M7: 2018-08-30T00:00:00.000 | N7: 2018-11-24T00:00:00.000 | O7: 9 | P7: 2019-02-03T00:00:00.000 | Q7: 1
A8: 10007 | B8: ="client"&RC[-1]&"@gmail.com" -> client10007@gmail.com | C8: 1234 | M8: 2016-04-29T00:00:00.000 | N8: 2018-02-07T00:00:00.000 | O8: 31 | P8: 2018-03-23T00:00:00.000 | Q8: 1
A9: 10008 | B9: ="client"&RC[-1]&"@gmail.com" -> client10008@gmail.com | C9: 1234 | D9: Odom | E9: Scott | F9: 64 Rue du Château-Kirkland | G9: Kirkland | H9: QC | I9: H9J 3Z2 | J9: Canada | K9: (514) 378-6651 | M9: 2017-10-07T00:00:00.000 | N9: 2017-11-20T00:00:00.000 | O9: 1 | P9: 2019-02-05T00:00:00.000 | Q9: 1
A10: 10009 | B10: ="client"&RC[-1]&"@gmail.com" -> client10009@gmail.com | C10: 1234 | M10: 2017-03-17T00:00:00.000 | N10: 2018-12-16T00:00:00.000 | O10: 62 | P10: 2019-01-17T00:00:00.000 | Q10: 1
A11: 10010 | B11: ="client"&RC[-1]&"@gmail.com" -> client10010@gmail.com | C11: 1234 | M11: 2017-03-16T00:00:00.000 | O11: 13 | P11: 2019-01-10T00:00:00.000 | Q11: 1
A12: 10011 | B12: ="client"&RC[-1]&"@gmail.com" -> client10011@gmail.com | C12: 1234 | M12: 2018-03-19T00:00:00.000 | O12: 12 | P12: 2019-01-05T00:00:00.000 | Q12: 1
A13: 10012 | B13: ="client"&RC[-1]&"@gmail.com" -> client10012@gmail.com | C13: 1234 | M13: 2016-01-28T00:00:00.000 | O13: 2 | P13: 2016-02-09T00:00:00.000 | Q13: 1
A14: 10013 | B14: ="client"&RC[-1]&"@gmail.com" -> client10013@gmail.com | C14: 1234 | M14: 2017-07-19T00:00:00.000 | N14: 2017-10-21T00:00:00.000 | O14: 68 | P14: 2017-11-22T00:00:00.000 | Q14: 1
A15: 10014 | B15: ="client"&RC[-1]&"@gmail.com" -> client10014@gmail.com | C15: 1234 | D15: Bowen | E15: Theo | F15: 766 Rue de Longpré | G15: Québec | H15: QC | I15: G1V 2R9 | J15: Canada | K15: (418) 283-2494 | M15: 2018-12-11T00:00:00.000 | N15: 2019-01-31T00:00:00.000 | O15: 48 | P15: 2019-02-05T00:00:00.000 | Q15: 1
A16: 10015 | B16: ="client"&RC[-1]&"@gmail.com" -> client10015@gmail.com | C16: 1234 | M16: 2017-09-13T00:00:00.000 | O16: 73 | P16: 2019-02-06T00:00:00.000 | Q16: 1
A17: 10016 | B17: ="client"&RC[-1]&"@gmail.com" -> client10016@gmail.com | C17: 1234 | M17: 2017-04-03T00:00:00.000 | O17: 42 | P17: 2019-01-02T00:00:00.000 | Q17: 1
A18: 10017 | B18: ="client"&RC[-1]&"@gmail.com" -> client10017@gmail.com | C18: 1234 | M18: 2016-05-29T00:00:00.000 | O18: 34 | P18: 2019-02-01T00:00:00.000 | Q18: 1
A19: 10018 | B19: ="client"&RC[-1]&"@gmail.com" -> client10018@gmail.com | C19: 1234 | D19: Rowland | E19: Patrick | F19: 5254 Rue Paré | G19: Montréal | H19: QC | I19: H4P 1P5 | J19: Canada | K19: (514) 488-5104 | M19: 2018-04-09T00:00:00.000 | N19: 2018-09-03T00:00:00.000 | O19: 14 | P19: 2019-02-05T00:00:00.000 | Q19: 1
A20: 10019 | B20: ="client"&RC[-1]&"@gmail.com" -> client10019@gmail.com | C20: 1234 | D20: Cordova | E20: Brandon | F20: 81 Avenue St Louis | G20: Beaconsfield | H20: QC | I20: H9W 4X8 | J20: Canada | K20: (514) 969-8988 | M20: 2018-12-12T00:00:00.000 | N20: 2019-01-01T00:00:00.000 | O20: 46 | P20: 2019-02-06T00:00:00.000 | Q20: 1
A21: 10020 | B21: ="client"&RC[-1]&"@gmail.com" -> client10020@gmail.com | C21: 1234 | D21: Mcdowell | E21: Leonard | F21: 560 King Ave | G21: Bathurst | H21: NB | I21: E2A 1P7 | J21: Canada | K21: (506) 546-4484 | M21: 2018-08-02T00:00:00.000 | N21: 2019-01-21T00:00:00.000 | O21: 63 | P21: 2019-02-06T00:00:00.000 | Q21: 1

Sheet: PPVendeurs
A1: NoVendeur | B1: NomAffaires | C1: Nom | D1: Prenom | E1: Rue | F1: Ville | G1: Province | H1: CodePostal | I1: Pays | J1: Tel1 | K1: Tel2 | L1: AdresseEmail | M1: MotDePasse | N1: PoidsMaxLivraison | O1: LivraisonGratuite | P1: Taxes | Q1: Pourcentage | R1: Configuration | S1: DateCreation | T1: DateMAJ | U1: Statut
A2: 11 | B2: Electronics Crafts | C2: Hudson | D2: James | E2: 6860 Sherbrooke St E | F2: Montréal | G2: QC | H2: H1N 1E2 | I2: Canada | J2: (514) 255-0832 | L2: vendeur11@gmail.com | M2: 1234 | N2: 210 | O2: 45 | P2: 1 | Q2: 5 | S2: 2018-12-09T00:00:00.000 | U2: 1
A3: 12 | B3: Signature Design | C3: Haddigan | D3: Ashley | E3: 900 Boulevard de la Côte-Vertu | F3: Saint-Laurent | G3: QC | H3: H4L 1Y4 | I3: Canada | J3: (514) 747-6132 | L3: vendeur12@gmail.com | M3: 1234 | N3: 350 | O3: 180 | P3: 1 | Q3: 6 | S3: 2017-08-16T00:00:00.000 | T3: 2018-04-04T00:00:00.000 | U3: 1
A4: 13 | B4: Tek Maison | C4: Riel | D4: Louis | E4: 2075 Boulevard Chomedey | F4: Laval | G4: QC | H4: H7T 0B2 | I4: Canada | J4: (450) 681-1126 | L4: vendeur13@gmail.com | M4: 1234 | N4: 450 | O4: 320 | P4: 1 | S4: 2019-02-05T00:00:00.000 | U4: 0
A5: 14 | B5: Panda Office | C5: Desjardin | D5: Michel | E5: 399 Bathurst St | F5: Toronto | G5: ON | H5: M5T 2S8 | I5: Canada | J5: (416) 603-5801 | L5: vendeur14@gmail.com | M5: 1234 | N5: 150 | O5: 425 | P5: 1 | Q5: 3 | S5: 2016-06-14T00:00:00.000 | T5: 2018-08-23T00:00:00.000 | U5: 1
A6: 15 | B6: Clothing Dart | C6: Rockwood | D6: Dennis | E6: 11200 Boul. Cavendish Place Vertu | F6: Saint-Laurent | G6: QC | H6: H4R 2J7 | I6: Canada | J6: (514) 337-4862 | L6: vendeur15@gmail.com | M6: 1234 | N6: 150 | O6: 525 | P6: 1 | S6: 2019-01-01T00:00:00.000 | U6: 0
A7: 16 | B7: Amazon | C7: Bezos | D7: Jeff | E7: 835 Rue Montarville | F7: Longueuil | G7: QC | H7: J4H 2M5 | I7: Canada | J7: (450) 677-3535 | L7: vendeur16@gmail.com | M7: 1234 | N7: 800 | O7: 25 | P7: 1 | Q7: 8 | S7: 2017-05-01T00:00:00.000 | T7: 2019-02-05T00:00:00.000 | U7: 1
A8: 17 | B8: Magazine Premier Choix | C8: Labonté | D8: John | E8: 243 St Marys St | F8: Fredericton | G8: NB | H8: E3A 2S5 | I8: Canada | J8: (506) 459-1707 | L8: vendeur17@gmail.com | M8: 1234 | N8: 300 | O8: 135 | P8: 1 | Q8: 5 | S8: 2017-11-02T00:00:00.000 | T8: 2018-05-02T00:00:00.000 | U8: 1

Sheet: PPProduits
A1: NoProduit | B1: NoVendeur | C1: NoCategorie | D1: Nom | E1: Description | F1: Photo | G1: PrixDemande | H1: NombreItems | I1: Disponibilité | J1: DateVente | K1: PrixVente | L1: Poids | M1: DateCreation | N1: DateMAJ
A2: 1100001 | B2: 11 | C2: 10 | D2: T-Fal Maison Grille-pain | E2: t-fal Maison grille-pain, fentes extra larges, haut ascenseur installation, réchauffage, arrêt et bagels paramètres. Capacité de 4 tranche. 1700 watts. Idéal pour épais ou fines tranches de pain. 2 plateaux ramasse-miettes amovible pour un nettoyage facile. Indépendante 2 ou 4 chambres de tranche. 3 automatique fonctions personnalisées grillé : 6 niveaux de brunissage et 1 fonction décongélation. surélevage pour un retrait facile des petites tranches de pain. | F2: 1100001.jpg | G2: 69.989999999999995 | H2: 4 | I2: 1 | L2: 5.69 | M2: 2018-12-27T00:00:00.000
A3: 1400001 | B3: 14 | C3: 10 | D3: Multicuiseur électrique Instant Pot Ultra | E3: La cuisinière programmable à usages multiples Ultra Pot Ultra 10-en-1 est la nouvelle génération d'appareils de cuisine. Conçu pour le chef à la maison recherchant un degré de personnalisation et de contrôle supérieur pour une cuisson encore plus précise. L'Ultra combine les fonctions d'autocuiseur, de mijoteuse, de cuiseur de riz / porridge, de pâtissier, de préparateur de yaourt, de sauté / rissolage, de cuisson à la vapeur, de réchauffeur, de stérilisateur et, entre autres, du programme Ultra Le «Ultra» offre une programmation personnalisée complète pour la cuisson sous pression et sans pression. | F3: 1400001.jpg | G3: 199.95 | H3: 27 | I3: 1 | L3: 12 | M3: 2016-08-01T00:00:00.000 | N3: 2018-04-08T00:00:00.000
A4: 1400002 | B4: 14 | C4: 10 | D4: Bouilloire électrique sans fil | E4: La conception sans fil et la base pivotante à 360 ° permettent de verser et de servir facilement. Avec protection automatique à l’arrêt et à l’ébullition pour une plus grande tranquillité d’esprit. Capacité 1.7L, base pivotante à 360 °, protection automatique contre l'ébullition à sec et l'ébullition, facile à voir deux fenêtres d'eau,- filtre intégré, marche / arrêt | F4: 1400002.jpg | G4: 32.99 | H4: 3 | I4: 1 | L4: 2.09 | M4: 2017-11-29T00:00:00.000 | N4: 2018-02-21T00:00:00.000
A5: 1600001 | B5: 16 | C5: 10 | D5: Machine à pain | E5: Conçue pour la nutrition, cette machine à pain comporte des réglages tels que sans gluten et à grains entiers, vous permettant de cuire du pain sain à l’aide d’une variété de farines. Personnalisez votre pain à la taille et à la nuance avec 3 tailles de pain et 3 nuances de croûte. Et le minuteur vous permet d'ajouter des ingrédients et de commencer le processus de cuisson plus tard. | F5: 1600001.jpg | G5: 84.99 | H5: 4 | I5: 1 | J5: 2019-09-29T00:00:00.000 | K5: 64.989999999999995 | L5: 9.99 | M5: 2018-03-25T00:00:00.000
A6: 1600002 | B6: 16 | C6: 10 | D6: Couteau électrique | E6: Le couteau électrique de Cuisinart ajoute un peu d'électricité à tous les travaux de taille d'or, car il fournit l'énergie supplémentaire dont a besoin une vraie cuisine. commando, son puissant moteur doté de deux astuces tranchantes en acier inoxydable (une et une pour le pain) permet de couper rapidement toutes les tâches. | F6: 1600002.jpg | G6: 49.99 | H6: 18 | I6: 1 | J6: 2017-12-15T00:00:00.000 | K6: 39.99 | L6: 4.4800000000000004 | M6: 2018-02-05T00:00:00.000
A7: 1600003 | B7: 16 | C7: 10 | D7: Plaque de cuisson à induction portable | E7: Notre plaque de cuisson à induction portable dispose un modèle basse consommation qui laisse sans perte de chaleur pour les zones autour de la cuisson en acier inoxydable ou en bateau. L'écran LED permettant un choix de 8 différentes températures de cuisson de 140 à 465 degrés Fahrenheit. La minuterie intégrée permet jusqu'à trois heures Cook avec arrêt automatique et offre un signal sonore pour que vous connaissez le cycle de cuisson est complète. | F7: 1600003.jpg | G7: 74.989999999999995 | H7: 13 | I7: 1 | J7: 2018-07-03T00:00:00.000 | K7: 64.989999999999995 | L7: 5.45 | M7: 2017-05-11T00:00:00.000
A8: 1600004 | B8: 16 | C8: 10 | D8: Cuiseur à œufs en acier inoxydable | E8: Le cuiseur automatique d'oeufs est conçu pour vous aider à cuire rapidement jusqu'à 7 oeufs exactement comme vous les aimez. Une tasse à mesurer incluse vous permet de calibrer le niveau d'eau afin de préparer les œufs de la même manière que vous le souhaitez. doux, moyen ou dur. Fabriqué avec un matériau en acier inoxydable, ce cuiseur à oeufs est sûr et facile à nettoyer, à stocker et à utiliser. Idéal pour toute maison, camping-car, camping-car ou dortoir. | F8: 1600004.jpg | G8: 25.99 | H8: 2 | I8: 1 | J8: 2019-02-22T00:00:00.000 | K8: 19.989999999999998 | L8: 1.46 | M8: 2017-11-14T00:00:00.000
A9: 1600005 | B9: 16 | C9: 10 | D9: Mélangeur à main | E9: La batteur offre puissance et performance pour des résultats parfaits à chaque fois. Puissance exceptionnelle est par un moteur 250-watt, 6 vitesses offrent de polyvalence. Le confort poignée vous offre un confort inégalé et contrôle et l'étui permet un rangement facile. | F9: 1600005.jpg | G9: 33.979999999999997 | H9: 4 | I9: 1 | J9: 2019-04-19T00:00:00.000 | K9: 29.99 | L9: 2.78 | M9: 2017-12-22T00:00:00.000
A10: 1600006 | B10: 16 | C10: 10 | D10: Balance de cuisine numérique | E10: Max capacité : jusqu'à 5000 g/5000 ml/176 fl kg. Poids précis à 1 g/0,1 g. Unités de mesures disponibles : kg, grammes, onces, millilitres, onces liquides. | F10: 1600006.jpg | G10: 24.99 | H10: 2 | I10: 1 | J10: 2017-11-20T00:00:00.000 | K10: 21.99 | L10: 1.5 | M10: 2017-05-26T00:00:00.000 | N10: 2017-06-16T00:00:00.000
A11: 1600007 | B11: 16 | C11: 10 | D11: Thermomètre à viande pour barbecue | E11: Instant read meat thermometer gets temp readout within 4-7 seconds with high precision sensor | F11: 1600007.jpg | G11: 16.989999999999998 | H11: 5 | I11: 1 | J11: 2019-11-18T00:00:00.000 | K11: 12.99 | L11: 0.79 | M11: 2017-07-02T00:00:00.000 | N11: 2017-07-26T00:00:00.000
A12: 1200001 | B12: 12 | C12: 20 | D12: Chevron Bleu Pouf | E12: Style traditionnel. Tissé de bandes de denim. Assez robuste pour contenir un plateau de service. Fait à la main. Nettoyer les taches seulement. Fabriqué à partir de denim recyclé. | F12: 1200001.jpg | G12: 99.99 | H12: 7 | I12: 1 | L12: 9.99 | M12: 2018-10-29T00:00:00.000
A13: 1200002 | B13: 12 | C13: 20 | D13: Banc de salle à manger en Marron foncé | E13: Style décontracté. Rembourrage en peluche et élégante button-tufted en imitation cuir. Bords et coins ont un arrondi, effet usé pour un look décontracté. Tufté avec revêtement PU. Fabriqué à partir de chêne massif et bois dur solides. | F13: 1200002.jpg | G13: 110.35 | H13: 0 | I13: 0 | L13: 33.979999999999997 | M13: 2018-10-17T00:00:00.000
A14: 1200003 | B14: 12 | C14: 20 | D14: Tabouret | E14: Finition : marron rustique. Matière : Pin planked placage haut et base tubulaire en métal. Vintage style décontracté. Finition vieillie. Table de bar en métal tubulaire, finition en étain couleur noir. | F14: 1200003.jpg | G14: 192.76 | H14: 6 | I14: 1 | L14: 23.99 | M14: 2018-04-04T00:00:00.000 | N14: 2019-01-06T00:00:00.000
A15: 1200004 | B15: 12 | C15: 20 | D15: Lampe de table en métal | E15: Interrupteur 3 positions. Type requis d'une ampoule CFL 150 W max ou 26 W max. | F15: 1200004.jpg | G15: 78.989999999999995 | H15: 3 | I15: 1 | L15: 10.98 | M15: 2016-09-27T00:00:00.000
A16: 1200005 | B16: 12 | C16: 20 | D16: Table basse | E16: La base est composée d'anneaux métalliques empilés qui dégagent une sensation tendance et innovante. Fini avec une finition légère en bois naturel pour un contraste froid | F16: 1200005.jpg | G16: 310.92 | H16: 2 | I16: 1 | L16: 34.99 | M16: 2016-10-30T00:00:00.000
A17: 1200006 | B17: 12 | C17: 20 | D17: Tapis en Doré | E17: Tufté à la main. Code de nettoyage : nettoyage à sec uniquement. Tapis Pad recommandés. Envers en coton et latex. Fabriqué à partir de laine overtwisted. | F17: 1200006.jpg | G17: 199.99 | H17: 4 | I17: 1 | L17: 16.98 | M17: 2017-12-05T00:00:00.000 | N17: 2018-09-22T00:00:00.000
A18: 1200007 | B18: 12 | C18: 20 | D18: Pendentif en métal léger | E18: Nécessite trois 8 watts ou 40 watts CFL ampoule de type A max. Style contemporain. x marque le spot pour les médias mixtes chic. En métal et en tissu léger est juste à la maison en milieu industriel, éclectique et même les espaces contemporains. Fabriqué à partir de métal. | F18: 1200007.jpg | G18: 549.99 | H18: 1 | I18: 1 | L18: 12.99 | M18: 2017-03-03T00:00:00.000 | N18: 2018-05-25T00:00:00.000
A19: 1200008 | B19: 12 | C19: 20 | D19: Banc de rangement, Marron foncé | E19: Fabriqué avec des placages, bois et bois. Habilement conçu avec un siège lift-top pour un rangement cachée sous-jacent | F19: 1200008.jpg | G19: 325.99 | H19: 1 | I19: 1 | L19: 69.989999999999995 | M19: 2017-11-02T00:00:00.000
A20: 1200009 | B20: 12 | C20: 20 | D20: Petit bureau | E20: Le poste de travail de bureau est fait de bois, de placages et de bois d'ingénierie au fini patiné. Conçu avec 2 tablettes fixes et comprend un panier en jacinthe d’eau pour le rangement | F20: 1200009.jpg | G20: 421.99 | H20: 2 | I20: 1 | L20: 38.17 | M20: 2018-04-23T00:00:00.000
A21: 1200010 | B21: 12 | C21: 20 | D21: Armoire d'appoint | E21: Fait de placages, de bois et de bois d'ingénierie au fini sarcelle d'antan. Fabriqué avec 4 portes d'armoire avec incrustations en verre clair qui révèlent 2 tablettes réglables | F21: 1200010.jpg | G21: 1169.99 | H21: 1 | I21: 1 | L21: 173.05 | M21: 2017-12-12T00:00:00.000 | N21: 2018-12-15T00:00:00.000
A22: 1200011 | B22: 12 | C22: 20 | D22: lampe Arc en métal | E22: Avec des bras et du cou réglable et l'idée géniale pour un variateur sur le poste, cette lampe frappant three-arm Metal ARC permet que la lumière soit — exactement comme vous le souhaitez. | F22: 1200011.jpg | G22: 249.99 | H22: 3 | I22: 1 | L22: 34.049999999999997 | M22: 2018-01-07T00:00:00.000
A23: 1200012 | B23: 12 | C23: 20 | D23: Grande Cheminée électrique | E23: Cette cheminée comprend flamme qui fonctionne avec ou sans, réglage de température à 2 niveaux de chaleur infrarouge et une télécommande, de pair avec un dispositif de contrôle de surchauffe pour plus de sécurité. | F23: 1200012.jpg | G23: 341.89 | H23: 2 | I23: 1 | L23: 57.09 | M23: 2018-08-10T00:00:00.000 | N23: 2018-10-12T00:00:00.000
A24: 1400003 | B24: 14 | C24: 20 | D24: Organiseur à chaussures | E24: L'organiseur de chaussures à 4 étages est fabriqué en métal et plastique de haute qualité connecteurs répondent à votre demande de stockage à long terme. | F24: 1400003.jpg | G24: 23.99 | H24: 1 | I24: 1 | L24: 4.37 | M24: 2018-12-14T00:00:00.000 | N24: 2018-08-28T00:00:00.000
A25: 1600008 | B25: 16 | C25: 20 | D25: Chaise longue pliante | E25: Ouverture / fermeture de la cavité faciale avec fentes pour les bras, oreiller et dossier réglable permettant un bronzage ou une lecture confortable tout en restant sur le dos ou le ventre | F25: 1600008.jpg | G25: 62.99 | H25: 5 | I25: 1 | L25: 12.41 | M25: 2017-12-17T00:00:00.000 | N25: 2018-01-08T00:00:00.000
A26: 1600009 | B26: 16 | C26: 20 | D26: Parapluie portable de plage bleu | E26: Le parapluie mesure 6,5 pi de diamètre et le pôle central est en acier recouvert de couleur blanche et mesure 6,8 pi de hauteur. Le parapluie s'ouvre manuellement et le tissu est en oxford 210D avec revêtement en argent procurant une protection UV de 50+. | F26: 1600009.jpg | G26: 35.630000000000003 | H26: 1 | I26: 1 | L26: 4.2300000000000004 | M26: 2018-09-22T00:00:00.000
A27: 1600010 | B27: 16 | C27: 20 | D27: Balancelle en brut avec chaîne de suspendre | E27: Magnifiquement construit avec les meilleurs bois sapin massif, chaque pièce est construite pour durer et est livré partiellement assemblé, avec tout le matériel. Le sapin est inachevé. Chaîne incluse. Limite de poids 500 g/m². | F27: 1600010.jpg | G27: 115.99 | H27: 3 | I27: 1 | L27: 24.56 | M27: 2017-05-22T00:00:00.000
A28: 1600011 | B28: 16 | C28: 20 | D28: Table et chaises pliables, 3 pièces | E28: Durable, cadre en acier avec revêtement en poudre. 61 cm rond x 71,1 cm haut table comprend également deux chaises. | F28: 1600011.jpg | G28: 89.99 | H28: 7 | I28: 1 | L28: 35.24 | M28: 2018-01-22T00:00:00.000
A29: 1600012 | B29: 16 | C29: 20 | D29: Balancelle, inclut des Sangles de suspension | E29: Ce hamac est fabriqué à partir de nylon très résistant pouvant supporter jusqu’à 400 lb. Permettant de laisser de la place pour deux personnes!. Vous pouvez facilement l'installer dans votre jardin, vos parcs ou vos plages car il est fourni avec des courroies, des cordes et des crochets métalliques | F29: 1600012.jpg | G29: 26.99 | H29: 3 | I29: 1 | L29: 3.22 | M29: 2018-08-07T00:00:00.000 | N29: 2018-08-29T00:00:00.000
A30: 1600013 | B30: 16 | C30: 20 | D30: Ensemble canapé sans Stockage Marron | E30: Le double osier rond tissé à la main de première qualité complète les coussins de siège épais, les coussins de dossier et le coussin de repose-pieds avec un plateau en verre trempé inclus pour la table basse. | F30: 1600013.jpg | G30: 744.99 | H30: 2 | I30: 1 | L30: 74.84 | M30: 2018-09-30T00:00:00.000 | N30: 2018-10-26T00:00:00.000
A31: 1100002 | B31: 11 | C31: 30 | D31: Echo Dot | E31: Demandez à Alexa de jouer de la musique, répondre à des questions, lire les nouvelles, consulter les prévisions météo, programmer des alarmes et régler des minuteurs, contrôler des appareils connectés compatibles et plus encore. Écoutez des chansons sur Amazon Music, Spotify, Radioplayer, Deezer et d’autres services, avec un son riche, par le biais du haut-parleur intégré. | F31: 1100002.jpg | G31: 69.989999999999995 | H31: 65 | I31: 1 | L31: 3.55 | M31: 2018-12-16T00:00:00.000 | N31: 2018-01-13T00:00:00.000
A32: 1100003 | B32: 11 | C32: 30 | D32: Caméra avec vision de nuit | E32: Avec la détection de mouvement et de son, vous pouvez recevoir une alerte chaque fois que votre caméra détecte le son et le mouvement et visionner jusqu'à 14 jours de vidéos d'alerte enregistrées | F32: 1100003.jpg | G32: 37.49 | H32: 13 | I32: 1 | L32: 2.5099999999999998 | M32: 2018-12-19T00:00:00.000
A33: 1100004 | B33: 11 | C33: 30 | D33: Imprimante sans fil avec scanner et copieur | E33: Format compact, avec réglable lettre/légal capacité de 250 feuilles, bac jusqu'à capacité de 50 feuilles, chargeur de documents automatique et manuelle de la fente d'alimentation pour des enveloppes. | F33: 1100004.jpg | G33: 139.99 | H33: 20 | I33: 1 | L33: 20.53 | M33: 2018-12-14T00:00:00.000
A34: 1100005 | B34: 11 | C34: 30 | D34: GoPro Hero7 Noir | E34: Caméra numérique étanche avec écran tactile 4 K vidéo HD 12 MP photos en direct Stabilisation en streaming | F34: 1100005.jpg | G34: 529.99 | H34: 7 | I34: 1 | L34: 0.86 | M34: 2018-12-13T00:00:00.000 | N34: 2018-12-29T00:00:00.000
A35: 1100006 | B35: 11 | C35: 30 | D35: HyperX Cloud II | E35: Casque de jeu pour PC et PS4 | F35: 1100006.jpg | G35: 114.98 | H35: 29 | I35: 1 | L35: 3.55 | M35: 2018-12-15T00:00:00.000
A36: 1600014 | B36: 16 | C36: 30 | D36: Logitech G502 Proteus Spectrum RGB | E36: Souris de jeu accordable | F36: 1600014.jpg | G36: 75.989999999999995 | H36: 26 | I36: 1 | L36: 1.52 | M36: 2018-07-13T00:00:00.000 | N36: 2018-08-04T00:00:00.000
A37: 1600015 | B37: 16 | C37: 30 | D37: Hub de données 4 ports | E37: Transformez l'une de vos ports USB de l'ordinateur en quatre | F37: 1600015.jpg | G37: 18.989999999999998 | H37: 2 | I37: 1 | L37: 0.6 | M37: 2017-06-19T00:00:00.000 | N37: 2017-07-13T00:00:00.000
A38: 1600016 | B38: 16 | C38: 30 | D38: Disque dur externe portatif USB 3.0, 2 Tera | E38: Transfert de données rapide grâce à la connectivité USB 3.0 | F38: 1600016.jpg | G38: 89.79 | H38: 24 | I38: 1 | L38: 1.06 | M38: 2017-08-25T00:00:00.000
A39: 1600017 | B39: 16 | C39: 30 | D39: Fitbit Versas Smart Watch | E39: Faites la connaissance de Fitbit Versa, un compagnon qui vous aide toute la journée à vivre votre meilleure vie. Cette montre intelligente, légère et résistante à l'eau, vous permet d'atteindre vos objectifs de santé et de remise en forme grâce à des informations exploitables, des conseils personnalisés, des séances d'entraînement à l'écran, etc. | F39: 1600017.jpg | G39: 229.99 | H39: 2 | I39: 1 | L39: 0.42 | M39: 2018-07-01T00:00:00.000 | N39: 2018-07-24T00:00:00.000
A40: 1100007 | B40: 11 | C40: 40 | D40: Pampers Baby Dry couches jetables | E40: Les couches pour bébé séchées Pampers sont 3x plus sèches pour une protection du sommeil toute la nuit. Votre bébé peut avoir jusqu'à 12 heures de sécheresse nocturne avec des couches pour bébé déshydratées de Pampers. | F40: 1100007.jpg | G40: 37.29 | H40: 2 | I40: 1 | J40: 2019-03-06T00:00:00.000 | K40: 27.99 | L40: 3.51 | M40: 2018-12-25T00:00:00.000
A41: 1100008 | B41: 11 | C41: 40 | D41: Pampers Baby Lingettes | E41: Les lingettes Pampers Complete Clean nettoient de haut en bas. Un toucher doux et une résistance durable rendent ces lingettes polyvalentes suffisamment solides pour résister aux changements de mains et aux changements de couches, tout en étant suffisamment douces pour nettoyer le visage délicat de votre bébé. Sans parfum pour un nettoyant hypoallergénique et testé dermatologiquement. | F41: 1100008.jpg | G41: 24.98 | H41: 34 | I41: 1 | J41: 2019-04-25T00:00:00.000 | K41: 19.989999999999998 | L41: 2.0299999999999998 | M41: 2018-12-11T00:00:00.000 | N41: 2018-12-28T00:00:00.000
A42: 1100009 | B42: 11 | C42: 40 | D42: Munchkin 6 Cuillères pour bébé à pointe souple | E42: Aussi facile à utiliser car ils sont amusants, ces cuillères à pointe souple sont parfaits pour votre petit munchkin. Chacun est conçu de façon ergonomique pour un maximum de confort, et fabriqué en matériau sans BPA souple qui est doux pour les gencives de votre bébé. | F42: 1100009.jpg | G42: 4.97 | H42: 25 | I42: 1 | J42: 2017-11-07T00:00:00.000 | K42: 3.99 | L42: 0.28999999999999998 | M42: 2018-12-27T00:00:00.000
A43: 1400004 | B43: 14 | C43: 40 | D43: Bol d'aspiration, 3-pack | E43: munchkin 49003 trois bol ventouse Stay Put, 3-pack | F43: 1400004.jpg | G43: 9.98 | H43: 11 | I43: 1 | L43: 0.86 | M43: 2018-09-08T00:00:00.000
A44: 1400005 | B44: 14 | C44: 40 | D44: Assiette à compartiments et bol. | E44: Le design moderne n'entrera pas en conflit avec votre décor et le fond antidérapant signifie moins de dégâts. Sans BPA, va au micro-ondes et au lave-vaisselle, ces assiettes et bols sont nécessaires pour le petit-déjeuner, le déjeuner et le dîner! | F44: 1400005.jpg | G44: 16.97 | H44: 0 | I44: 1 | L44: 0.97 | M44: 2017-09-14T00:00:00.000
A45: 1400006 | B45: 14 | C45: 40 | D45: Crayola Sécurité Ciseaux | E45: Ciseaux conçus uniquement pour couper du papier et du carton stock. Not doigts ou les poils les bouts arrondis et lames en plastique sont sans danger pour les petites mains de coupe 3 différents patterns-straight zigzag, ondulés et comprend 3 paires de ciseaux ne convient pas aux enfants de moins de 3 ans | F45: 1400006.jpg | G45: 3.29 | H45: 5 | I45: 1 | L45: 0.53 | M45: 2016-12-14T00:00:00.000
A46: 1400007 | B46: 14 | C46: 40 | D46: Jouet - Sac - 80 Briques | E46: The 80 piece Maxi Blocks Classic Bag by Mega Bloks includes 80 big building blocks! It is the perfect toy for your little building fan who is just learning how to build with his own two hands. | F46: 1400007.jpg | G46: 16.940000000000001 | H46: 22 | I46: 1 | L46: 2.56 | M46: 2018-05-13T00:00:00.000
A47: 1600018 | B47: 16 | C47: 40 | D47: Sac à langer pour bébé | E47: Le sac à langer est fabriqué de l'environnement et durable Tissu résistant à l'eau, facile à nettoyer. Si vous n'avez pas peur du lait ou de l'eau par inadvertance sur le sac lors de nourrir le bébé. | F47: 1600018.jpg | G47: 39.99 | H47: 5 | I47: 1 | L47: 6.37 | M47: 2018-04-08T00:00:00.000
A48: 1600019 | B48: 16 | C48: 40 | D48: Sous-vêtements d'entraînement pour filles | E48: Les canaux d'absorption supplémentaires exclusifs offrent une protection exceptionnelle contre les fuites, de jour comme de nuit | F48: 1600019.jpg | G48: 37.97 | H48: 3 | I48: 1 | L48: 3.64 | M48: 2018-07-23T00:00:00.000
A49: 1600020 | B49: 16 | C49: 40 | D49: Housse de siège auto pour bébé Ciel | E49: En tissu respirant pour garder l'air plus rapidement lors de la mère l'allaitement maternel bébé ou bébé dormir sur le siège de voiture. Extensible et doux, fabriqué en mélange de rayonne, s'adapte à la plupart des sièges de voiture et des mères qui allaitent, chaise haute et panier. | F49: 1600020.jpg | G49: 19.95 | H49: 3 | I49: 1 | L49: 1.21 | M49: 2018-04-26T00:00:00.000
A50: 1600021 | B50: 16 | C50: 40 | D50: Skip Hop bébé Angle de vue du centre d'activité | E50: Conçu en collaboration avec un pédiatre, notre centre d’activités pour bébés soutient une approche globale du corps pour jouer et apprendre. Facile à assembler, avec des jouets pouvant être placés n'importe où pour bébé, il est doté d'un siège pivotant à 360 degrés qui tourne et s'étire pour rebondir. | F50: 1600021.jpg | G50: 122.15 | H50: 3 | I50: 0 | L50: 8.51 | M50: 2018-03-12T00:00:00.000
A51: 1600022 | B51: 16 | C51: 40 | D51: Fisher-Price dôme bébé | E51: Même lorsque les bébés sont dehors, ils peuvent se sentir bien et en sécurité (comme à la maison!) Dans le rembourrage doux et le dais protecteur du dôme On-the-Go Baby. Et ces jouets colorés ne sont pas seulement amusants… ils aident les bébés occupés à renforcer leur motricité fine! | F51: 1600022.jpg | G51: 83.98 | H51: 4 | I51: 1 | L51: 4.6100000000000003 | M51: 2017-09-11T00:00:00.000
A52: 1600023 | B52: 16 | C52: 40 | D52: Siège rehausseur, Bleu/vert/gris | E52: Pratique, sûr et confortable, le siège rehausseur Healthy Care Deluxe de luxe est doté d’un plateau d’alimentation que vous pouvez assainir directement au lave-vaisselle, ce qui rend les repas plus sains et plus propres que jamais. Conçu pour les enfants pesant jusqu'à 50 livres, ce siège pratique se plie également de manière compacte et comprend une sangle de transport pour que vous puissiez l'emporter avec vous partout. | F52: 1600023.jpg | G52: 39.99 | H52: 3 | I52: 1 | L52: 5.62 | M52: 2018-10-19T00:00:00.000 | N52: 2018-11-07T00:00:00.000
A53: 1600024 | B53: 16 | C53: 40 | D53: Organiseur de jouet de bain | E53: Il s'agit d'une boîte de rangement en plastique avec lattes de sorte que les canalisations d'eau à l'extérieur. Il se pose sur la baignoire de sorte que les jouets sont facile pour votre enfant à portée de main. | F53: 1600024.jpg | G53: 23.99 | H53: 6 | I53: 1 | L53: 1.23 | M53: 2018-11-13T00:00:00.000 | N53: 2018-12-07T00:00:00.000
A54: 1600025 | B54: 16 | C54: 40 | D54: Marcheur d'apprentissage | E54: Aide votre bébé à passer de la chenille à la marche grâce à la technologie adaptative. Avec une basse-cour d'amusants joueurs pour les encourager, votre tout-petit s'amusera sans fin à apprendre à marcher. | F54: 1600025.jpg | G54: 41.78 | H54: 1 | I54: 1 | L54: 7.43 | M54: 2017-10-30T00:00:00.000
A55: 1100010 | B55: 11 | C55: 50 | D55: Marchepied en acier | E55: Conçu avec un cadre en tube d'acier durable et de larges marches à plate-forme en acier avec inserts de gomme pour une meilleure traction. | F55: 1100010.jpg | G55: 119.99 | H55: 3 | I55: 1 | L55: 15.35 | M55: 2018-12-12T00:00:00.000
A56: 1100011 | B56: 11 | C56: 50 | D56: Système de vadrouille et d’essoreuse rotative | E56: Serpillière entièrement faite de microfibre pour soulever, récurer et absorber la saleté. | F56: 1100011.jpg | G56: 35.99 | H56: 4 | I56: 1 | L56: 35.99 | M56: 2018-12-24T00:00:00.000 | N56: 2018-12-28T00:00:00.000
A57: 1100012 | B57: 11 | C57: 50 | D57: Divers produits de nettoyage, 2.4L | E57: Il enlève facilement les sols et tue 99,9% des bactéries *. Utilisez-le pour l'extérieur des toilettes, le nettoyage de la baignoire et des sols. C est particulièrement utile pour les endroits difficiles comme les zones pour animaux domestiques et les seaux à couches. Essayez-le sur les poubelles et plus encore. | F57: 1100012.jpg | G57: 7.97 | H57: 2 | I57: 1 | L57: 4.3 | M57: 2018-12-20T00:00:00.000
A58: 1100013 | B58: 11 | C58: 50 | D58: Marteau à table lisse | E58: Pesant seulement 12 oz, il frappe avec la force d'un marteau de 28 oz. Le modèle léger et le manche amortisseur de vibrations minimisent la fatigue, et le porte-clou magnétique permet de placer rapidement le clou d'une seule main. | F58: 1100013.jpg | G58: 49 | H58: 6 | I58: 1 | L58: 3.2 | M58: 2018-12-16T00:00:00.000
A59: 1200013 | B59: 12 | C59: 50 | D59: Perceuse-visseuse MAX, sans fil | E59: La perceuse-visseuse dispose d'un mandrin sans clé de 3/8 po qui permet des changements de foret rapides et faciles. Sa conception compacte et légère permet un maniement facile et un embrayage à 24 positions empêchant les vis de s'endommager et de s'enfoncer. La perceuse-visseuse est alimentée par une batterie au lithium-ion qui garde sa charge jusqu'à 18 mois pour un usage de longue durée. | F59: 1200013.jpg | G59: 68.790000000000006 | H59: 4 | I59: 1 | L59: 6.31 | M59: 2018-11-01T00:00:00.000
A60: 1400008 | B60: 14 | C60: 50 | D60: Scie circulaire sans fil(outil seulement) | E60: La semelle en magnésium robuste et légère assure la durabilité sur le chantier et une précision de coupe durable. L'outil est doté d'une poignée surmoulée en caoutchouc confortable et optimisée qui maximise l'équilibre, la maîtrise et le confort de l'utilisateur. Il offre une capacité de coupe en biseau de 0 à 50 degrés, pour des coupes en biseau efficaces dans le cadre d'applications diverses. L'outil comprend une lame à pointes au carbure de 6 1/2 po pour la coupe de matériau de double épaisseur à 90 degrés et à 45 degrés, et offre plus de coupes par charge. | F60: 1400008.jpg | G60: 179.99 | H60: 3 | I60: 1 | L60: 18.239999999999998 | M60: 2018-02-12T00:00:00.000 | N60: 2018-12-03T00:00:00.000
A61: 1400009 | B61: 14 | C61: 50 | D61: Ponceuse à bande/toupie oscillante | E61: La table pivote de 0 à 48º, avec des crans darrêt aux angles les plus courants (0º, 15º, 22,5º, 30º, 45º) pour le ponçage des biseaux. La machine est complètement équipée avec une bande abrasive de 4 x 24 po (10 x 61 cm), tous les cylindre et un jeu de manchons (3/4, 1, 1 1/2 et 2 po [19, 25, 38 et 51 mm]) ce qui permet de lutiliser dès quelle est sortie de sa boîte. | F61: 1400009.jpg | G61: 248.99 | H61: 5 | I61: 1 | L61: 47.98 | M61: 2017-04-28T00:00:00.000 | N61: 2017-05-07T00:00:00.000
A62: 1600026 | B62: 16 | C62: 50 | D62: Ensemble de tournevis de précision (6 pièces) | E62: Chaque outil est pratique pour poser des vis sur des appareils électroniques ou des bibelots et pour toute autre tâche impliquant de petits objets. | F62: 1600026.jpg | G62: 7.99 | H62: 15 | I62: 1 | L62: 1.5 | M62: 2018-04-13T00:00:00.000 | N62: 2018-05-08T00:00:00.000
A63: 1600027 | B63: 16 | C63: 50 | D63: Toupie portative à vitesse variable | E63: Le moteur est doté d'une électronique de démarrage en douceur, d'une molette de réglage de vitesse et d'une électronique Constant Response permettant de travailler à vitesse constante quelle que soit la charge. | F63: 1600027.jpg | G63: 149.99 | H63: 5 | I63: 1 | L63: 5.31 | M63: 2018-03-14T00:00:00.000
A64: 1600028 | B64: 16 | C64: 50 | D64: Boîte à outils professionnelle, 22 po, noir | E64: Cette boîte à outils est durable et faite de résine hautement résistante aux chocs. Elle est munie de loquets en métal robustes et d'un joint d'étanchéité protégeant son contenu de l'eau et de la poussière. | F64: 1600028.jpg | G64: 69.989999999999995 | H64: 3 | I64: 1 | L64: 7.41 | M64: 2018-12-30T00:00:00.000
A65: 1600029 | B65: 16 | C65: 50 | D65: Compresseur d'air électrique portable | E65: Le compresseur d'air est équipé d'un moteur peu énergivore de 2,6 A aidant à prévenir le déclenchement du disjoncteur. Pouvant atteindre une pression de 135 lb/po² pour accélérer le clouage, il est équipé d'un réservoir de 1 gallon. Sa pompe sans huile procure une utilisation durable sans entretien. | F65: 1600029.jpg | G65: 179.99 | H65: 6 | I65: 1 | L65: 28.89 | M65: 2017-09-16T00:00:00.000
A66: 1600030 | B66: 16 | C66: 50 | D66: Tuyau d'Air pneumatique | E66: Boyau durable en vinyle 25 pi, compatible avec les autres compresseurs. | F66: 1600030.jpg | G66: 29.99 | H66: 5 | I66: 1 | L66: 10.58 | M66: 2018-07-09T00:00:00.000 | N66: 2018-07-25T00:00:00.000
A67: 1600031 | B67: 16 | C67: 50 | D67: Soudeuse semi-automatique | E67: Si vous avez accès à une alimentation dentrée industrielle 208/230 V, vous pouvez souder sur des matériaux plus épais, jusquà 3/16 po avec le soudage MIG et ½ po avec soudage avec fil fourré sans gaz. | F67: 1600031.jpg | G67: 699.99 | H67: 1 | I67: 1 | L67: 77.2 | M67: 2017-06-21T00:00:00.000 | N67: 2017-07-01T00:00:00.000
A68: 1600032 | B68: 16 | C68: 50 | D68: Source de courant de soudage | E68: Grâce à son fonctionnement à reconnexion automatique 120/230 V, l'Invertec® V155-S peut fonctionner sur un groupe électrogène portable. Elle peut se brancher également à un cordon prolongateur de 200 pi (61 m) 230 V (pas inclus) de sorte que vous pouvez souder à peu près partout. La carrosserie robuste résistant aux bosses a une classe de protection de IP23 pour utilisation à l'extérieur. | F68: 1600032.jpg | G68: 2049.9899999999998 | H68: 3 | I68: 1 | L68: 13.98 | M68: 2018-12-16T00:00:00.000 | N68: 2019-01-01T00:00:00.000
A69: 1100014 | B69: 11 | C69: 60 | D69: Burton Polaire pour femme Minxy | E69: Séchage rapide, doux polaire offrent une agréable à porter. Coupe classique. surdimensionné capuche fixe réglable avec cordon de fermeture. Fermeture Éclair intégrale sur le devant pour la fermeture. Manches longues avec poignets côtelés. Poches pour les mains. Transportez vos morceaux dans la poche de rangement empilables avec port du câble. Empiècement demi-lune au dos. Ourlet droit. 100% polyester. Lavage en machine à froid, sécher à basse température. Importé. | F69: 1100014.jpg | G69: 220.52 | H69: 4 | I69: 1 | L69: 2.5099999999999998 | M69: 2019-01-01T00:00:00.000
A70: 1100015 | B70: 11 | C70: 60 | D70: Manteaux d'hiver pour femme | E70: Le manteau d'hiver pour femme est doté d'une membrane Omni-TechMC qui vous protège contre les intempéries et l'humidité, tout en permettant à l'excès de chaleur de s'échapper pendant vos activités dynamiques. | F70: 1100015.jpg | G70: 12.23 | H70: 4 | I70: 1 | L70: 1.54 | M70: 2018-12-10T00:00:00.000
A71: 1100016 | B71: 11 | C71: 60 | D71: Fermeture Éclair complète Cascade pour femme | E71: Vêtement innovant conçu pour vous aider à exécuter, dans le train, et jouer comme un champion. | F71: 1100016.jpg | G71: 35.99 | H71: 5 | I71: 0 | L71: 0.95 | M71: 2018-12-25T00:00:00.000 | N71: 2019-01-02T00:00:00.000
A72: 1100017 | B72: 11 | C72: 60 | D72: Sweat à capuche manches longues | E72: Pas très épais en tissu, adapté pour le travail, le sport et porter au quotidien en automne et au printemps. | F72: 1100017.jpg | G72: 7.99 | H72: 4 | I72: 1 | L72: 0.37 | M72: 2018-12-13T00:00:00.000 | N72: 2019-01-01T00:00:00.000
A73: 1100018 | B73: 11 | C73: 60 | D73: Blouson aviateur à capuchon | E73: Blouson aviateur en similicuir avec capuchon amovible. | F73: 1100018.jpg | G73: 83.3 | H73: 3 | I73: 1 | L73: 0.71 | M73: 2018-12-16T00:00:00.000 | N73: 2018-12-29T00:00:00.000
A74: 1100019 | B74: 11 | C74: 60 | D74: T-shirt en coton à imprimé délavé | E74: T-shirt tout-aller en coton à motif contrastant intégral. | F74: 1100019.jpg | G74: 20.3 | H74: 6 | I74: 1 | L74: 0.24 | M74: 2019-01-01T00:00:00.000
A75: 1100020 | B75: 11 | C75: 60 | D75: Cravate à pois en mélange de soie | E75: Cravate en mélange de soie tissé rehaussé d'un motif à pois. | F75: 1100020.jpg | G75: 37.119999999999997 | H75: 4 | I75: 0 | L75: 0.18 | M75: 2018-12-19T00:00:00.000
A76: 1100021 | B76: 11 | C76: 60 | D76: Noeud papillon tissé en soie unie à effet chiné | E76: Ce noeud papillon tissé en soie présente une allure style chambray qui lui confère une touche rustique. | F76: 1100021.jpg | G76: 39.119999999999997 | H76: 6 | I76: 1 | L76: 0.77 | M76: 2018-12-16T00:00:00.000
A77: 1100022 | B77: 11 | C77: 60 | D77: Chemisier à motif guingan | E77: Chemisier tendance à motif guingan intégral. | F77: 1100022.jpg | G77: 39.99 | H77: 6 | I77: 1 | L77: 0.53 | M77: 2018-12-24T00:00:00.000
A78: 1100023 | B78: 11 | C78: 60 | D78: Jean moulant classique | E78: Rehaussez votre style avec ce superbe jean moulant. | F78: 1100023.jpg | G78: 48.3 | H78: 9 | I78: 1 | L78: 1.23 | M78: 2018-12-18T00:00:00.000
A79: 1100024 | B79: 11 | C79: 60 | D79: T-shirt en coton à manches longues | E79: T-shirt tout-aller essentiel en coton orné de rayures contrastantes intégrales. | F79: 1100024.jpg | G79: 41.97 | H79: 2 | I79: 1 | L79: 1.01 | M79: 2018-12-19T00:00:00.000
A80: 1100025 | B80: 11 | C80: 60 | D80: Flâneurs Littleton | E80: Le double empiècement à élastique et l'assise plantaire en latex font de ce modèle Littleton de Dockers le choix parfait pour un confort tout-aller, un ajustement et une allure incomparables. | F80: 1100025.jpg | G80: 110 | H80: 5 | I80: 1 | L80: 3.59 | M80: 2018-12-15T00:00:00.000 | N80: 2018-12-25T00:00:00.000
A81: 1100026 | B81: 11 | C81: 60 | D81: Boxeur en coton à imprimé | E81: Boxeur en coton doux à imprimé intégral. | F81: 1100026.jpg | G81: 19.5 | H81: 13 | I81: 1 | L81: 0.26 | M81: 2019-01-01T00:00:00.000
A82: 1100027 | B82: 11 | C82: 60 | D82: Gants en cuir à revers en tricot avec surpiqûres | E82: Gants de cuir avec poignets en tricot, pour homme. | F82: 1100027.jpg | G82: 51 | H82: 5 | I82: 1 | L82: 0.93 | M82: 2018-12-26T00:00:00.000
A83: 1400010 | B83: 14 | C83: 60 | D83: Écharpe en tricot Onsemile | E83: Écharpe essentielle rehaussée de détails texturés. | F83: 1400010.jpg | G83: 31.5 | H83: 15 | I83: 1 | L83: 0.71 | M83: 2017-03-03T00:00:00.000
A84: 1400011 | B84: 14 | C84: 60 | D84: Casquette en velours | E84: Casquette en velours côtelé à cinq panneaux avec applique du logo sur le devant. | F84: 1400011.jpg | G84: 20 | H84: 9 | I84: 1 | L84: 1.32 | M84: 2018-05-25T00:00:00.000 | N84: 2018-11-08T00:00:00.000
A85: 1400012 | B85: 14 | C85: 60 | D85: Tapis d'exercice avec sangle de transport | E85: Fait de mousse légère et durable. | F85: 1400012.jpg | G85: 23.66 | H85: 7 | I85: 1 | L85: 2.4500000000000002 | M85: 2018-11-10T00:00:00.000 | N85: 2019-01-30T00:00:00.000
A86: 1400013 | B86: 14 | C86: 60 | D86: Plongée en néoprène pour homme 5 mm | E86: Le 5 mm ultra polyvalent est excellent pour les eaux tropicales, en particulier dans les mois d'hiver, mais est également assez chaud pour les fraîches des sites de plongée au plus proche de chez vous. A 5 mm au niveau du torse favorise la chaleur corporelle et 5 mm balance des extremites de chaleur et flexibilité. Cette combinaison éprouvée design est facile à don et dispose d'un collier ajustable qui empêche un échange d'eau au niveau de la nuque. | F86: 1400013.jpg | G86: 149.99 | H86: 6 | I86: 1 | L86: 4.7 | M86: 2018-05-23T00:00:00.000 | N86: 2018-08-21T00:00:00.000
A87: 1600033 | B87: 16 | C87: 60 | D87: Planche de surf souple | E87: Longboard de surf. Fabriqué au Pérou pour les entreprises de taille moyenne Surf. Dimensions 2,7 m x 23,5 en X 3.1 en et un maximum suggéré Rider Poids de 104,3 kilogram. Poignée de transport ergonomique. Bare Board Poids brut 6,8 kilogram. | F87: 1600033.jpg | G87: 179.99 | H87: 3 | I87: 1 | L87: 10.210000000000001 | M87: 2018-08-09T00:00:00.000 | N87: 2018-08-20T00:00:00.000
A88: 1600034 | B88: 16 | C88: 60 | D88: Casque de ski pour adulte | E88: Casque de ski dostar intégralement protégée du vent léger et professionnel en plein air snowboards adultes casque de sports de neige | F88: 1600034.jpg | G88: 49.99 | H88: 0 | I88: 1 | L88: 1.1499999999999999 | M88: 2018-02-17T00:00:00.000
A89: 1600035 | B89: 16 | C89: 60 | D89: Masque de ski | E89: Caractéristiques double objectif, p-80 + couche antibuée, protection UV, ventilation flow-tech, parfait pour masque et l'intégration du casque, et des technologies de système optique du sport. | F89: 1600035.jpg | G89: 64.319999999999993 | H89: 5 | I89: 1 | L89: 0.4 | M89: 2018-07-21T00:00:00.000
A90: 1600036 | B90: 16 | C90: 60 | D90: Bottes de neige | E90: Cyclisme à lacets bottines en cuir manteau imperméable et isolée en nylon supérieure arctique fond en caoutchouc Flex anneau en D fermeture en dentelle avant offre un confort optimal apporte de la chaleur et du confort dans des températures jusqu'à 94 Celsius, semelle intérieure et semelle intérieure. | F90: 1600036.jpg | G90: 216.33 | H90: 3 | I90: 1 | L90: 9.81 | M90: 2018-03-09T00:00:00.000
A91: 1100028 | B91: 11 | C91: 70 | D91: Finition naturelle Guitare acoustique | E91: Chaque modèle de guitare mesure environ 10 pouces. de longueur et est livré avec un pied réglable en A de haute qualité et un coffret pour étui à guitare de haute qualité. Les répliques miniatures Axes Heaven ont fière allure mais ne sont pas jouables. | F91: 1100028.jpg | G91: 37.99 | H91: 7 | I91: 1 | L91: 0.26 | M91: 2018-12-20T00:00:00.000
A92: 1100029 | B92: 11 | C92: 70 | D92: Sac, 1/2 guitare classique | E92: Nos sacs CG-075 ont un extérieur noir DuraGuard et une doublure anti-rayures. Avec 3 mm de rembourrage, ces sacs ont une seule bandoulière et une grande poche. | F92: 1100029.jpg | G92: 33.61 | H92: 2 | I92: 1 | L92: 3.37 | M92: 2018-12-23T00:00:00.000 | N92: 2018-12-28T00:00:00.000
A93: 1100030 | B93: 11 | C93: 70 | D93: Tele Corps Guitare électrique | E93: Les guitares ont une touche puissante sans flexion, un bon effilage, une bonne forme et de bons sons car elles sont fabriquées par une machine cnc avec une programmation informatique en 3D | F93: 1100030.jpg | G93: 170.09 | H93: 1 | I93: 1 | L93: 8.4499999999999993 | M93: 2018-12-15T00:00:00.000
A94: 1600037 | B94: 16 | C94: 70 | D94: Stand pour Clavier simple en X | E94: Supportant jusqu'à 130 lb, les manchons en caoutchouc réglables peuvent être positionnés pour s’adapter à pratiquement toutes les largeurs de clavier. La hauteur est réglable de 27 à 38 pouces. | F94: 1600037.jpg | G94: 28.99 | H94: 12 | I94: 1 | L94: 7.61 | M94: 2018-01-28T00:00:00.000 | N94: 2018-02-24T00:00:00.000
A95: 1600038 | B95: 16 | C95: 70 | D95: Alesis Recital 88-key débutant Piano numérique | E95: Le récital propose 5 voix intégrées réalistes: piano acoustique, piano électrique, orgue, synthé et basse. Personnalisez les voix en combinant deux en même temps en mode Calque pour obtenir un son riche et plein. Ils peuvent également être affectés uniquement aux mains gauche ou droite en mode Split. Vous pouvez même ajouter des effets de réverbération et de chorus ajustables pour personnaliser davantage votre son. Avec de puissants haut-parleurs intégrés de 20 watts et une polyphonie de 128 notes maximum, Recital offre un son ultra réaliste et une expérience de jeu exceptionnelle. | F95: 1600038.jpg | G95: 299.99 | H95: 3 | I95: 1 | L95: 15.66 | M95: 2017-08-14T00:00:00.000
A96: 1600039 | B96: 16 | C96: 70 | D96: Focusrite Scarlett Interface audio USB | E96: Il est compact mais polyvalent, avec deux préamplis micro Scarlett au son naturel, une latence très basse et la même qualité sonore et la même conversion numérique que le reste de la gamme Scarlett. Emportez-le n'importe où, connectez un seul câble USB à un ordinateur, branchez deux micros ou instruments directement, et enregistrez facilement un son de qualité studio. | F96: 1600039.jpg | G96: 209 | H96: 10 | I96: 1 | L96: 1.3 | M96: 2018-01-19T00:00:00.000 | N96: 2018-01-29T00:00:00.000
A97: 1100031 | B97: 11 | C97: 80 | D97: Diffuseur d'huiles | E97: En plus de ses utilisations dans l'aromathérapie, cette huile essentielle diffuseur fonctionne aussi bien comme un petit humidificateur et une veilleuse. Ce diffuseur d'arômes à ultrasons fonctionne pendant 3,5–5,5 heures en haut brume et 5–9 heures en mode basse brume continue (mode veille). Plus aucune fuite, aucune défaillance de plus. | F97: 1100031.jpg | G97: 22.99 | H97: 2 | I97: 1 | L97: 0.53 | M97: 2018-12-23T00:00:00.000
A98: 1100032 | B98: 11 | C98: 80 | D98: Livre : L'art de la méditation | E98: Matthieu Ricard, fils du philosophe français Jean-François Revel et de l'artiste peintre Yahne Le Toumelin, est moine bouddhiste, auteur, traducteur et photographe. Après un premier voyage en Inde en 1967 où il rencontre de grands maîtres spirituels tibétains, il termine son doctorat en génétique cellulaire à l'Institut Pasteur en 1972 sous la direction de François Jacob, puis part s'installer définitivement dans l'Himalaya où il vit depuis plus de 45 ans. Il réside au monastère de Shéchèn au Népal. Sous l'égide de l'Institut Mind and Life il collabore depuis une douzaine d'années à plusieurs programmes de recherches en neurosciences sur les effets de l'entraînement de l'esprit et de la méditation dans les Universités américaines et Européennes. (www.matthieuricard.org) L'association humanitaire qu'il a créée, Karuna-Shechen (www.karuna-shechen.org) a développé 130 projets éducatifs, médicaux, et sociaux dans la région himalayenne. Il lui dédie l'intégralité de ses droits d'auteurs et bénéfices de ses activités. Chez NiL, il a publié, entre autres, Le Moine et le Philosophe (avec son père Jean-François Revel), Plaidoyer pour le bonheur, L'Art de la méditation, Chemins spirituels et Plaidoyer pour l'altruisme. | F98: 1100032.jpg | G98: 19.87 | H98: 21 | I98: 1 | L98: 0.63 | M98: 2018-12-25T00:00:00.000
A99: 1400014 | B99: 14 | C99: 80 | D99: 100 aliments céto à volonté | E99: Cet ouvrage présente 100 aliments que l’on peut consommer les yeux fermés lorsqu’on suit un régime cétogène ou un régime pauvre en glucides dont le plus célèbre est le régime Atkins.• L’alimentation cétogène consiste à consommer beaucoup de graisses (de qualité), juste ce qu’il faut de protéines et très peu de glucides. | F99: 1400014.jpg | G99: 29.95 | H99: 5 | I99: 1 | L99: 0.6 | M99: 2018-06-08T00:00:00.000
A100: 1400015 | B100: 14 | C100: 80 | D100: La bible des sauces | E100: Gourmet et gourmand, Jérôme Ferrer conjugue depuis toujours la gastronomie et l’art de manger sainement au quotidien. Finies les béchamels farineuses et les hollandaises lourdes : les classiques restent, mais les sauces du 21e siècle sont éclatées, exotiques et légères et, de l’entrée au dessert, elles raviront tous les palais et tous les budgets. | F100: 1400015.jpg | G100: 31.46 | H100: 5 | I100: 1 | L100: 0.78 | M100: 2018-01-02T00:00:00.000
A101: 1400016 | B101: 14 | C101: 80 | D101: Pendentif en or blanc avec diamant | E101: Pierres précieuses : citrine véritable, forme ronde, 10 mm, 7,12 carats, teinte citrouille dorée et brillante. Diamant 0,02 carat avec couleur G-H et clarté SI1 SI2. Pendentif : 1,04 grammes, or blanc pur 14 carats avec poinçon 14 carats, le pendentif présente un design, un savoir-faire et une finition exceptionnels. Cadeau parfait pour la fête des mères, un anniversaire, la Saint-Valentin, l'obtention d'un diplôme, Noël ou toute autre occasion. - Comprend une chaîne de 45,7 cm et un coffret cadeau assorti. Style P9214 | F101: 1400016.jpg | G101: 195.99 | H101: 2 | I101: 1 | L101: 2.15 | M101: 2017-12-14T00:00:00.000
A102: 1400017 | B102: 14 | C102: 80 | D102: Croquettes pour chien | E102: Pour les chiens adultes, la saveur de dinde rôtie et de légumes est parfaite pour votre meilleur ami. Cette recette de viande faite avec le bon équilibre de grains entiers et de protéines avec des accents végétaux qui garderont votre chien adulte en bonne santé et actif. Il est complet et équilibré à 100% pour la santé et la vitalité. La croquette unique est de la taille idéale et offre un croquant savoureux à la dinde à chaque bouchée. | F102: 1400017.jpg | G102: 44.47 | H102: 1 | I102: 0 | L102: 28.9 | M102: 2016-09-11T00:00:00.000
A103: 1400018 | B103: 14 | C103: 80 | D103: Tabac par Maurer & Wirtz Cologne/eau de toilette | E103: Créé par la maison de design de maurer & wirtz en 1959, tabac est classé comme un Sharp doux parfum floral. Cette fragrance masculine contient un mélange de lavande et d'agrumes senteurs florales chaudes. | F103: 1400018.jpg | G103: 29.24 | H103: 3 | I103: 1 | L103: 0.64 | M103: 2017-02-24T00:00:00.000
A104: 1400019 | B104: 14 | C104: 80 | D104: Rétractable stylos à encre gel effaçable | E104: Combine la commodité d'un rétractable à l'incroyable encre gel effaçable FriXion, efface et réécrit plusieurs fois sans endommager les documents. , Rechargeable, paquet de 3 stylos à pointe fine avec encre noire | F104: 1400019.jpg | G104: 15.36 | H104: 5 | I104: 1 | L104: 0.2 | M104: 2016-08-06T00:00:00.000 | N104: 2017-09-06T00:00:00.000
A105: 1600040 | B105: 16 | C105: 80 | D105: Merkur rasoir de sécurité double lame de rasoir | E105: La poignée profilée et lestée repose facilement dans n'importe quelle main et un motif molleté mat assure une prise ferme, même lorsqu'elle est mouillée. Une lame à double tranchant fournit des résultats lisses. Compatible avec les lames standard à double tranchant. Rasoir de sûreté classique pour les rasages de près professionnels. | F105: 1600040.jpg | G105: 18.989999999999998 | H105: 12 | I105: 1 | L105: 0.24 | M105: 2018-06-18T00:00:00.000 | N105: 2018-07-15T00:00:00.000

Sheet: PPDetailsCommandes
A1: NoDetailCommande | B1: NoCommande | C1: NoProduit | D1: PrixVente | E1: Quantité
A2: 1 | B2: 1 | C2: 1100011 | D2: 35.99 | E2: 1
A3: =R[-1]C+1 -> 2 | B3: 1 | C3: 1100019 | D3: 20.3 | E3: 1
A4: =R[-1]C+1 -> 3 | B4: 2 | C4: 1600033 | D4: 179.99 | E4: 1
A5: =R[-1]C+1 -> 4 | B5: 2 | C5: 1600035 | D5: 64.319999999999993 | E5: 1
A6: =R[-1]C+1 -> 5 | B6: 3 | C6: 1200013 | D6: 68.790000000000006 | E6: 1
A7: =R[-1]C+1 -> 6 | B7: 3 | C7: 1200005 | D7: 310.92 | E7: 1
A8: =R[-1]C+1 -> 7 | B8: 3 | C8: 1200012 | D8: 341.89 | E8: 1
A9: =R[-1]C+1 -> 8 | B9: 4 | C9: 1400003 | D9: 23.99 | E9: 1
A10: =R[-1]C+1 -> 9 | B10: 4 | C10: 1400001 | D10: 199.95 | E10: 1
A11: =R[-1]C+1 -> 10 | B11: 4 | C11: 1400008 | D11: 179.99 | E11: 1
A12: =R[-1]C+1 -> 11 | B12: 4 | C12: 1400009 | D12: 248.99 | E12: 1
A13: =R[-1]C+1 -> 12 | B13: 5 | C13: 1400009 | D13: 248.99 | E13: 1
A14: =R[-1]C+1 -> 13 | B14: 5 | C14: 1400011 | D14: 20 | E14: 1
A15: =R[-1]C+1 -> 14 | B15: 6 | C15: 1200011 | D15: 249.99 | E15: 1
A16: =R[-1]C+1 -> 15 | B16: 6 | C16: 1200001 | D16: 99.99 | E16: 1
A17: =R[-1]C+1 -> 16 | B17: 7 | C17: 1200004 | D17: 78.989999999999995 | E17: 1
A18: =R[-1]C+1 -> 17 | B18: 8 | C18: 1600015 | D18: 18.989999999999998 | E18: 1
A19: =R[-1]C+1 -> 18 | B19: 8 | C19: 1600021 | D19: 122.15 | E19: 1
A20: =R[-1]C+1 -> 19 | B20: 8 | C20: 1600025 | D20: 41.78 | E20: 1
A21: =R[-1]C+1 -> 20 | B21: 9 | C21: 1100001 | D21: 69.989999999999995 | E21: 1
A22: =R[-1]C+1 -> 21 | B22: 9 | C22: 1100003 | D22: 37.49 | E22: 1
A23: =R[-1]C+1 -> 22 | B23: 10 | C23: 1100005 | D23: 529.99 | E23: 1
A24: =R[-1]C+1 -> 23 | B24: 10 | C24: 1100011 | D24: 35.99 | E24: 1
A25: =R[-1]C+1 -> 24 | B25: 10 | C25: 1100012 | D25: 7.97 | E25: 1
A26: =R[-1]C+1 -> 25 | B26: 11 | C26: 1200013 | D26: 68.790000000000006 | E26: 1
A27: =R[-1]C+1 -> 26 | B27: 11 | C27: 1200011 | D27: 249.99 | E27: 1
A28: =R[-1]C+1 -> 27 | B28: 11 | C28: 1200006 | D28: 199.99 | E28: 1
A29: =R[-1]C+1 -> 28 | B29: 11 | C29: 1200005 | D29: 310.92 | E29: 1
A30: =R[-1]C+1 -> 29 | B30: 12 | C30: =1200001 -> 1200001 | D30: 99.99 | E30: 1
A31: =R[-1]C+1 -> 30 | B31: 12 | C31: 1200013 | D31: 68.790000000000006 | E31: 1
A32: =R[-1]C+1 -> 31 | B32: 13 | C32: 1600008 | D32: 62.99 | E32: 1
A33: =R[-1]C+1 -> 32 | B33: 13 | C33: 1600011 | D33: 89.99 | E33: 1
A34: =R[-1]C+1 -> 33 | B34: 13 | C34: 1600013 | D34: 744.99 | E34: 1
A35: =R[-1]C+1 -> 34 | B35: 14 | C35: 1600008 | D35: 62.99 | E35: 1
A36: =R[-1]C+1 -> 35 | B36: 14 | C36: 1600023 | D36: 39.99 | E36: 1
A37: =R[-1]C+1 -> 36 | B37: 15 | C37: 1600028 | D37: 69.989999999999995 | E37: 1
A38: =R[-1]C+1 -> 37 | B38: 15 | C38: =1600025 + 1 -> 1600026 | D38: 7.99 | E38: 1
A39: =R[-1]C+1 -> 38 | B39: 15 | C39: 1600034 | D39: 49.99 | E39: 1
A40: =R[-1]C+1 -> 39 | B40: 15 | C40: 1600040 | D40: 18.989999999999998 | E40: 1
A41: =R[-1]C+1 -> 40 | B41: 16 | C41: 1200007 | D41: 549.99 | E41: 1
A42: =R[-1]C+1 -> 41 | B42: 17 | C42: 1200002 | D42: 110.35 | E42: 1
A43: =R[-1]C+1 -> 42 | B43: 17 | C43: 1200012 | D43: 341.89 | E43: 1

Sheet: PPCommandes
A1: NoCommande | B1: NoClient | C1: NoVendeur | D1: DateCommande | E1: CoutLivraison | F1: TypeLivraison | G1: MontantTotAvantTaxes | H1: TPS | I1: TVQ | J1: PoidsTotal | K1: Statut | L1: NoAutorisation
A2: 1 | B2: 10001 | C2: 11 | D2: 2019-02-04T00:00:00.000 | E2: 0 | F2: 1 | G2: 73.959999999999994 | H2: =(RC[-1]+RC[-3])*0.05 -> 3.698 | I2: =(RC[-2]+RC[-4])*0.09975 -> 7.37751 | J2: 6.57 | K2: N | L2: 4065
A3: 2 | B3: 10001 | C3: 16 | D3: 2019-02-05T00:00:00.000 | E3: 0 | F3: 2 | G3: 244.31 | H3: =(RC[-1]+RC[-3])*0.05 -> 12.2155 | I3: =(RC[-2]+RC[-4])*0.09975 -> 24.369922500000001 | J3: 10.61 | K3: N | L3: 4817
A4: 3 | B4: 10002 | C4: 12 | D4: 2019-01-29T00:00:00.000 | E4: 0 | F4: 1 | G4: 721.6 | H4: =(RC[-1]+RC[-3])*0.05 -> 36.080000000000005 | I4: =(RC[-2]+RC[-4])*0.09975 -> 71.979600000000005 | J4: 98.39 | K4: N | L4: 4164
A5: 4 | B5: 10004 | C5: 14 | D5: 2019-02-04T00:00:00.000 | E5: 0 | F5: 1 | G5: 652.92000000000007 | H5: =(RC[-1]+RC[-3])*0.05 -> 32.646000000000008 | I5: 0 | J5: 82.59 | K5: N | L5: 2279
A6: 5 | B6: 10014 | C6: 14 | D6: 2019-02-05T00:00:00.000 | E6: 29 | F6: 2 | G6: 268.99 | H6: =(RC[-1]+RC[-3])*0.05 -> 14.899500000000002 | I6: 0 | J6: 49.29 | K6: N | L6: 2829
A7: 6 | B7: 10018 | C7: 12 | D7: 2019-01-24T00:00:00.000 | E7: 0 | F7: 1 | G7: 349.98 | H7: =(RC[-1]+RC[-3])*0.05 -> 17.499000000000002 | I7: =(RC[-2]+RC[-4])*0.09975 -> 34.910505000000001 | J7: 44.04 | K7: N | L7: 4028
A8: 7 | B8: 10019 | C8: 12 | D8: 2019-01-28T00:00:00.000 | E8: 15.75 | F8: 2 | G8: 78.989999999999995 | H8: =(RC[-1]+RC[-3])*0.05 -> 4.7370000000000001 | I8: =(RC[-2]+RC[-4])*0.09975 -> 9.4503149999999998 | J8: 10.98 | K8: N | L8: 4084
A9: 8 | B9: 10020 | C9: 16 | D9: 2019-01-24T00:00:00.000 | E9: 0 | F9: 1 | G9: 182.92000000000002 | H9: =(RC[-1]+RC[-3])*0.05 -> 9.1460000000000008 | I9: =(RC[-2]+RC[-4])*0.09975 -> 18.246270000000003 | J9: 16.54 | K9: N | L9: 2705
A10: 9 | B10: 10001 | C10: 11 | D10: 2019-01-05T00:00:00.000 | E10: 0 | F10: 1 | G10: =69.99+37.49 -> 107.47999999999999 | H10: =(RC[-1]+RC[-3])*0.05 -> 5.3739999999999997 | I10: =(RC[-2]+RC[-4])*0.09975 -> 10.721129999999999 | J10: 8.1999999999999993 | K10: L | L10: 3997
A11: 10 | B11: 10001 | C11: 11 | D11: 2019-01-12T00:00:00.000 | E11: 0 | F11: 1 | G11: 573.95000000000005 | H11: =(RC[-1]+RC[-3])*0.05 -> 28.697500000000005 | I11: =(RC[-2]+RC[-4])*0.09975 -> 57.251512500000011 | J11: 41.15 | K11: L | L11: 4725
A12: 11 | B12: 10008 | C12: 12 | D12: 2019-01-08T00:00:00.000 | E12: 0 | F12: 1 | G12: =68.79+249.99+199.99+310.92 -> 829.69 | H12: =(RC[-1]+RC[-3])*0.05 -> 41.484500000000004 | I12: =(RC[-2]+RC[-4])*0.09975 -> 82.761577500000016 | J12: =6.31+34.05+16.98+34.99 -> 92.330000000000013 | K12: L | L12: 3375
A13: 12 | B13: 10014 | C13: 12 | D13: 2018-10-11T00:00:00.000 | E13: 12.5 | F13: 1 | G13: =99.99+68.79 -> 168.78 | H13: =(RC[-1]+RC[-3])*0.05 -> 9.0640000000000001 | I13: =(RC[-2]+RC[-4])*0.09975 -> 18.08268 | J13: =9.99+6.31 -> 16.3 | K13: L | L13: 1865
A14: 13 | B14: 10014 | C14: 16 | D14: 2019-01-15T00:00:00.000 | E14: 0 | F14: 1 | G14: =62.99+89.99+744.99 -> 897.97 | H14: =(RC[-1]+RC[-3])*0.05 -> 44.898500000000006 | I14: =(RC[-2]+RC[-4])*0.09975 -> 89.572507500000015 | J14: =12.41+35.24+74.84 -> 122.49000000000001 | K14: L | L14: 1338
A15: 14 | B15: 10014 | C15: 16 | D15: 2018-07-30T00:00:00.000 | E15: 0 | F15: 1 | G15: =62.99+39.99 -> 102.98 | H15: =(RC[-1]+RC[-3])*0.05 -> 5.1490000000000009 | I15: =(RC[-2]+RC[-4])*0.09975 -> 10.272255000000001 | J15: =12.41+5.62 -> 18.03 | K15: L | L15: 1052
A16: 15 | B16: 10014 | C16: 16 | D16: 2018-06-21T00:00:00.000 | E16: 0 | F16: 2 | G16: =69.99+7.99+49.99+18.99 -> 146.96 | H16: =(RC[-1]+RC[-3])*0.05 -> 7.3480000000000008 | I16: =(RC[-2]+RC[-4])*0.09975 -> 14.659260000000002 | J16: =7.41+1.5+1.15+0.24 -> 10.3 | K16: L | L16: 3031
A17: 16 | B17: 10020 | C17: 12 | D17: 2018-12-12T00:00:00.000 | E17: 0 | F17: 1 | G17: 549.99 | H17: =(RC[-1]+RC[-3])*0.05 -> 27.499500000000001 | I17: =(RC[-2]+RC[-4])*0.09975 -> 54.861502500000007 | J17: 12.99 | K17: L | L17: 3866
A18: 17 | B18: 10020 | C18: 12 | D18: 2017-10-12T00:00:00.000 | E18: 0 | F18: 1 | G18: =110.35+341.89 -> 452.24 | H18: =(RC[-1]+RC[-3])*0.05 -> 22.612000000000002 | I18: =(RC[-2]+RC[-4])*0.09975 -> 45.110940000000006 | J18: =33.98+57.09 -> 91.07 | K18: L | L18: 3049

Sheet: PPArticlesEnPanier
A1: NoPanier | B1: NoClient | C1: NoVendeur | D1: NoProduit | E1: DateCreation | F1: NbItems
A2: 1 | B2: 10001 | C2: 11 | D2: 1100008 | E2: 2019-02-04T00:00:00.000 | F2: 1
A3: =R[-1]C+1 -> 2 | B3: 10001 | C3: 11 | D3: 1100009 | E3: 2019-02-04T00:00:00.000 | F3: 1
A4: =R[-1]C+1 -> 3 | B4: 10001 | C4: 11 | D4: 1100025 | E4: 2019-02-05T00:00:00.000 | F4: 1
A5: =R[-1]C+1 -> 4 | B5: 10001 | C5: 11 | D5: 1100019 | E5: 2019-02-06T00:00:00.000 | F5: 1
A6: =R[-1]C+1 -> 5 | B6: 10001 | C6: 12 | D6: 1200007 | E6: 2019-01-16T00:00:00.000 | F6: 1
A7: =R[-1]C+1 -> 6 | B7: 10001 | C7: 12 | D7: 1200005 | E7: 2019-01-16T00:00:00.000 | F7: 1
A8: =R[-1]C+1 -> 7 | B8: 10001 | C8: 16 | D8: 1600004 | E8: 2019-02-05T00:00:00.000 | F8: 1
A9: =R[-1]C+1 -> 8 | B9: 10001 | C9: 16 | D9: 1600009 | E9: 2019-02-05T00:00:00.000 | F9: 1
A10: =R[-1]C+1 -> 9 | B10: 10001 | C10: 16 | D10: 1600036 | E10: 2019-02-06T00:00:00.000 | F10: 1
A11: =R[-1]C+1 -> 10 | B11: 10004 | C11: 12 | D11: 1200001 | E11: 2019-01-31T00:00:00.000 | F11: 1
A12: =R[-1]C+1 -> 11 | B12: 10004 | C12: 12 | D12: 1200003 | E12: 2019-01-23T00:00:00.000 | F12: 1
A13: =R[-1]C+1 -> 12 | B13: 10004 | C13: 12 | D13: 1200005 | E13: 2019-01-25T00:00:00.000 | F13: 1
A14: =R[-1]C+1 -> 13 | B14: 10004 | C14: 12 | D14: 1200006 | E14: 2019-01-26T00:00:00.000 | F14: 1
A15: =R[-1]C+1 -> 14 | B15: 10004 | C15: 12 | D15: 1200011 | E15: 2019-02-05T00:00:00.000 | F15: 1
A16: =R[-1]C+1 -> 15 | B16: 10004 | C16: 14 | D16: 1400005 | E16: 2019-02-05T00:00:00.000 | F16: 1
A17: =R[-1]C+1 -> 16 | B17: 10004 | C17: 14 | D17: 1400012 | E17: 2019-02-04T00:00:00.000 | F17: 1
A18: =R[-1]C+1 -> 17 | B18: 10004 | C18: 16 | D18: 1600002 | E18: 2019-01-13T00:00:00.000 | F18: 1
A19: =R[-1]C+1 -> 18 | B19: 10010 | C19: 11 | D19: 1100007 | E19: =RANDBETWEEN(DATE(2019,1,1),DATE(2019,2,5)) -> 2019-01-26T00:00:00.000 | F19: 1
A20: =R[-1]C+1 -> 19 | B20: 10010 | C20: 11 | D20: 1100012 | E20: =RANDBETWEEN(DATE(2019,1,1),DATE(2019,2,5)) -> 2019-01-17T00:00:00.000 | F20: 1
A21: =R[-1]C+1 -> 20 | B21: 10010 | C21: 11 | D21: 1100013 | E21: =RANDBETWEEN(DATE(2019,1,1),DATE(2019,2,5)) -> 2019-01-12T00:00:00.000 | F21: 1
A22: =R[-1]C+1 -> 21 | B22: 10010 | C22: 12 | D22: 1200002 | E22: =RANDBETWEEN(DATE(2019,1,1),DATE(2019,2,5)) -> 2019-02-05T00:00:00.000 | F22: 1
A23: =R[-1]C+1 -> 22 | B23: 10010 | C23: 12 | D23: 1200004 | E23: =RANDBETWEEN(DATE(2019,1,1),DATE(2019,2,5)) -> 2019-01-15T00:00:00.000 | F23: 1
A24: =R[-1]C+1 -> 23 | B24: 10016 | C24: 12 | D24: 1200010 | E24: =RANDBETWEEN(DATE(2019,1,1),DATE(2019,2,5)) -> 2019-01-12T00:00:00.000 | F24: 1
A25: =R[-1]C+1 -> 24 | B25: 10016 | C25: 12 | D25: 1200004 | E25: =RANDBETWEEN(DATE(2019,1,1),DATE(2019,2,5)) -> 2019-01-06T00:00:00.000 | F25: 1
A26: =R[-1]C+1 -> 25 | B26: 10019 | C26: 12 | D26: 1200006 | E26: 2019-01-31T00:00:00.000 | F26: 1
A27: =R[-1]C+1 -> 26 | B27: 10019 | C27: 12 | D27: 1200007 | E27: 2019-01-30T00:00:00.000 | F27: 1
A28: =R[-1]C+1 -> 27 | B28: 10019 | C28: 12 | D28: 1200012 | E28: 2019-02-01T00:00:00.000 | F28: 1
A29: =R[-1]C+1 -> 28 | B29: 10019 | C29: 14 | D29: 1400001 | E29: 2019-02-01T00:00:00.000 | F29: 1
A30: =R[-1]C+1 -> 29 | B30: 10019 | C30: 14 | D30: 1400018 | E30: 2019-01-30T00:00:00.000 | F30: 1

Sheet: PPHistoriquePaiements
A1: NoHistorique | B1: MontantVenteAvantLivraison | C1: NoVendeur | D1: NoClient | E1: NoCommande | F1: DateVente | G1: NoAutorisation | H1: FraisLesi | I1: Redevance | J1: FraisLivraison | K1: FraisTPS | L1: FraisTVQ
A2: 1 | B2: 73.959999999999994 | C2: 11 | D2: 10001 | E2: 1 | F2: 2019-02-04T00:00:00.000 | G2: 4065 | H2: =((RC[-6]+RC[2]+RC[3]+RC[4]) * 0.05) + 1.25 -> 5.5017754999999999 | I2: =RC[-7]*0.05 -> 3.698 | J2: 0 | K2: 3.698 | L2: 7.37751
A3: 2 | B3: 244.31 | C3: 16 | D3: 10001 | E3: 2 | F3: 2019-02-05T00:00:00.000 | G3: 4817 | H3: =((RC[-6]+RC[2]+RC[3]+RC[4]) * 0.05) + 1.25 -> 15.294771125 | I3: =RC[-7]*0.08 -> 19.544800000000002 | J3: 0 | K3: 12.2155 | L3: 24.369922500000001
A4: 3 | B4: 721.6 | C4: 12 | D4: 10002 | E4: 3 | F4: 2019-01-29T00:00:00.000 | G4: 4164 | H4: =((RC[-6]+RC[2]+RC[3]+RC[4]) * 0.05) + 1.25 -> 42.732980000000005 | I4: =RC[-7]*0.06 -> 43.295999999999999 | J4: 0 | K4: 36.080000000000005 | L4: 71.979600000000005
A5: 4 | B5: 652.92000000000007 | C5: 14 | D5: 10004 | E5: 4 | F5: 2019-02-04T00:00:00.000 | G5: 2279 | H5: =((RC[-6]+RC[2]+RC[3]+RC[4]) * 0.05) + 1.25 -> 35.528300000000002 | I5: =RC[-7]*0.03 -> 19.587600000000002 | J5: 0 | K5: 32.646000000000008 | L5: 0
A6: 5 | B6: 268.99 | C6: 14 | D6: 10014 | E6: 5 | F6: 2019-02-05T00:00:00.000 | G6: 2829 | H6: =((RC[-6]+RC[2]+RC[3]+RC[4]) * 0.05) + 1.25 -> 16.894475 | I6: =RC[-7]*0.03 -> 8.0696999999999992 | J6: 29 | K6: 14.899500000000002 | L6: 0
A7: 6 | B7: 349.98 | C7: 12 | D7: 10018 | E7: 6 | F7: 2019-01-24T00:00:00.000 | G7: 4028 | H7: =((RC[-6]+RC[2]+RC[3]+RC[4]) * 0.05) + 1.25 -> 21.369475250000004 | I7: =RC[-7]*0.06 -> 20.998799999999999 | J7: 0 | K7: 17.499000000000002 | L7: 34.910505000000001
A8: 7 | B8: 78.989999999999995 | C8: 12 | D8: 10019 | E8: 7 | F8: 2019-01-28T00:00:00.000 | G8: 4084 | H8: =((RC[-6]+RC[2]+RC[3]+RC[4]) * 0.05) + 1.25 -> 6.69636575 | I8: =RC[-7]*0.06 -> 4.7393999999999998 | J8: 15.75 | K8: 4.7370000000000001 | L8: 9.4503149999999998
A9: 8 | B9: 182.92000000000002 | C9: 16 | D9: 10020 | E9: 8 | F9: 2019-01-24T00:00:00.000 | G9: 2705 | H9: =((RC[-6]+RC[2]+RC[3]+RC[4]) * 0.05) + 1.25 -> 11.765613500000002 | I9: =RC[-7]*0.08 -> 14.633600000000001 | J9: 0 | K9: 9.1460000000000008 | L9: 18.246270000000003
A10: 9 | B10: 107.47999999999999 | C10: 11 | D10: 10001 | E10: 9 | F10: 2019-01-05T00:00:00.000 | G10: 3997 | H10: =((RC[-6]+RC[2]+RC[3]+RC[4]) * 0.05) + 1.25 -> 7.4287564999999995 | I10: =RC[-7]*0.05 -> 5.3739999999999997 | J10: 0 | K10: 5.3739999999999997 | L10: 10.721129999999999
A11: 10 | B11: 573.95000000000005 | C11: 11 | D11: 10001 | E11: 10 | F11: 2019-01-12T00:00:00.000 | G11: 4725 | H11: =((RC[-6]+RC[2]+RC[3]+RC[4]) * 0.05) + 1.25 -> 34.244950625000001 | I11: =RC[-7]*0.05 -> 28.697500000000005 | J11: 0 | K11: 28.697500000000005 | L11: 57.251512500000011
A12: 11 | B12: 829.69 | C12: 12 | D12: 10008 | E12: 11 | F12: 2019-01-08T00:00:00.000 | G12: 3375 | H12: =((RC[-6]+RC[2]+RC[3]+RC[4]) * 0.05) + 1.25 -> 48.946803875000008 | I12: =RC[-7]*0.06 -> 49.781400000000005 | J12: 0 | K12: 41.484500000000004 | L12: 82.761577500000016
A13: 12 | B13: 168.78 | C13: 12 | D13: 10014 | E13: 12 | F13: 2018-10-11T00:00:00.000 | G13: 1865 | H13: =((RC[-6]+RC[2]+RC[3]+RC[4]) * 0.05) + 1.25 -> 11.671334000000002 | I13: =RC[-7]*0.06 -> 10.126799999999999 | J13: 12.5 | K13: 9.0640000000000001 | L13: 18.08268
A14: 13 | B14: 897.97 | C14: 16 | D14: 10014 | E14: 13 | F14: 2019-01-15T00:00:00.000 | G14: 1338 | H14: =((RC[-6]+RC[2]+RC[3]+RC[4]) * 0.05) + 1.25 -> 52.872050375000008 | I14: =RC[-7]*0.08 -> 71.837600000000009 | J14: 0 | K14: 44.898500000000006 | L14: 89.572507500000015
A15: 14 | B15: 102.98 | C15: 16 | D15: 10014 | E15: 14 | F15: 2018-07-30T00:00:00.000 | G15: 1052 | H15: =((RC[-6]+RC[2]+RC[3]+RC[4]) * 0.05) + 1.25 -> 7.1700627500000005 | I15: =RC[-7]*0.08 -> 8.2384000000000004 | J15: 0 | K15: 5.1490000000000009 | L15: 10.272255000000001
A16: 15 | B16: 146.96 | C16: 16 | D16: 10014 | E16: 15 | F16: 2018-06-21T00:00:00.000 | G16: 3031 | H16: =((RC[-6]+RC[2]+RC[3]+RC[4]) * 0.05) + 1.25 -> 9.6983630000000005 | I16: =RC[-7]*0.08 -> 11.7568 | J16: 0 | K16: 7.3480000000000008 | L16: 14.659260000000002
A17: 16 | B17: 549.99 | C17: 12 | D17: 10020 | E17: 16 | F17: 2018-12-12T00:00:00.000 | G17: 3866 | H17: =((RC[-6]+RC[2]+RC[3]+RC[4]) * 0.05) + 1.25 -> 32.867550125000008 | I17: =RC[-7]*0.06 -> 32.999400000000001 | J17: 0 | K17: 27.499500000000001 | L17: 54.861502500000007
A18: 17 | B18: 452.24 | C18: 12 | D18: 10020 | E18: 17 | F18: 2017-10-12T00:00:00.000 | G18: 3049 | H18: =((RC[-6]+RC[2]+RC[3]+RC[4]) * 0.05) + 1.25 -> 27.248147000000003 | I18: =RC[-7]*0.06 -> 27.134399999999999 | J18: 0 | K18: 22.612000000000002 | L18: 45.110940000000006

Sheet: PPCategories
A1: NoCategorie | B1: Description | C1: Details
A2: 10 | B2: Articles de maison | C2: Électroménagers, accessoires de cuisines, de salle de bains, de chambres
A3: 20 | B3: Mobiliers | C3: Mobilier d'intérieur et d'extérieur
A4: 30 | B4: Articles électroniques | C4: Caméras, DVD, consoles de jeux, ordinateurs, portables, sans fil
A5: 40 | B5: Articles de bébé et enfants | C5: Vêtements, mobiliers, jouets, articles de sports et loisirs
A6: 50 | B6: Rénovation, bricolage, loisirs | C6: Outils, quincaillerie, articles variés
A7: 60 | B7: Vêtements et articles de sports | C7: Chaussures, vêtements, patins, raquettes, ski, équipement de hockey
A8: 70 | B8: Articles de musique | C8: Instruments, amplification, pièces et accessoires
A9: 80 | B9: Varia | C9: Un peu de tout ce qui n'appartient à aucune autre catégorie

Sheet: PPVendeursClients
A1: NoVendeur | B1: NoClient | C1: DateVisite
A2: 11 | B2: 10001 | C2: 2019-01-28T00:00:00.000
A3: 11 | B3: 10001 | C3: 2019-01-09T00:00:00.000
A4: 11 | B4: 10001 | C4: 2019-01-02T00:00:00.000
A5: 11 | B5: 10001 | C5: 2019-01-08T00:00:00.000
A6: 11 | B6: 10001 | C6: 2019-01-01T00:00:00.000
A7: 12 | B7: 10001 | C7: 2019-01-19T00:00:00.000
A8: 12 | B8: 10001 | C8: 2019-01-01T00:00:00.000
A9: 12 | B9: 10001 | C9: 2019-01-15T00:00:00.000
A10: 12 | B10: 10001 | C10: 2019-01-20T00:00:00.000
A11: 12 | B11: 10001 | C11: 2019-01-04T00:00:00.000
A12: 12 | B12: 10001 | C12: 2019-01-02T00:00:00.000
A13: 12 | B13: 10001 | C13: 2019-02-05T00:00:00.000
A14: 16 | B14: 10001 | C14: 2019-02-03T00:00:00.000
A15: 16 | B15: 10001 | C15: 2019-02-02T00:00:00.000
A16: 12 | B16: 10002 | C16: 2018-10-26T00:00:00.000
A17: 12 | B17: 10002 | C17: 2017-09-17T00:00:00.000
A18: 12 | B18: 10002 | C18: 2018-07-24T00:00:00.000
A19: 12 | B19: 10002 | C19: 2018-12-02T00:00:00.000
A20: 12 | B20: 10004 | C20: 2018-10-06T00:00:00.000
A21: 12 | B21: 10004 | C21: 2018-09-12T00:00:00.000
A22: 12 | B22: 10004 | C22: 2018-10-22T00:00:00.000
A23: 12 | B23: 10004 | C23: 2018-08-30T00:00:00.000
A24: 12 | B24: 10004 | C24: 2018-08-27T00:00:00.000
A25: 12 | B25: 10004 | C25: 2018-12-15T00:00:00.000
A26: 14 | B26: 10004 | C26: 2018-11-23T00:00:00.000
A27: 14 | B27: 10004 | C27: 2018-12-31T00:00:00.000
A28: 14 | B28: 10004 | C28: 2018-09-03T00:00:00.000
A29: 14 | B29: 10004 | C29: 2018-09-04T00:00:00.000
A30: 14 | B30: 10004 | C30: 2018-12-17T00:00:00.000
A31: 14 | B31: 10004 | C31: 2019-02-06T00:00:00.000
A32: 14 | B32: 10004 | C32: 2019-01-17T00:00:00.000
A33: 14 | B33: 10004 | C33: 2018-09-26T00:00:00.000
A34: 14 | B34: 10004 | C34: 2018-11-02T00:00:00.000
A35: 16 | B35: 10004 | C35: 2018-09-03T00:00:00.000
A36: 16 | B36: 10004 | C36: 2018-12-27T00:00:00.000
A37: 16 | B37: 10004 | C37: 2018-09-25T00:00:00.000
A38: 11 | B38: 10006 | C38: 2019-02-03T00:00:00.000
A39: 11 | B39: 10006 | C39: 2018-12-10T00:00:00.000
A40: 12 | B40: 10006 | C40: 2019-01-07T00:00:00.000
A41: 12 | B41: 10006 | C41: 2018-12-18T00:00:00.000
A42: 16 | B42: 10006 | C42: 2018-12-24T00:00:00.000
A43: 12 | B43: 10008 | C43: 2018-06-18T00:00:00.000
A44: 12 | B44: 10008 | C44: 2018-05-14T00:00:00.000
A45: 12 | B45: 10008 | C45: 2017-10-28T00:00:00.000
A46: 12 | B46: 10008 | C46: 2018-09-16T00:00:00.000
A47: 11 | B47: 10010 | C47: 2019-01-07T00:00:00.000
A48: 11 | B48: 10010 | C48: 2019-01-10T00:00:00.000
A49: 11 | B49: 10010 | C49: 2019-01-11T00:00:00.000
A50: 11 | B50: 10010 | C50: 2018-12-23T00:00:00.000
A51: 11 | B51: 10010 | C51: 2018-12-21T00:00:00.000
A52: 11 | B52: 10010 | C52: 2019-01-09T00:00:00.000
A53: 11 | B53: 10010 | C53: 2018-12-15T00:00:00.000
A54: 12 | B54: 10010 | C54: 2017-04-11T00:00:00.000
A55: 12 | B55: 10010 | C55: 2017-03-22T00:00:00.000
A56: 12 | B56: 10010 | C56: 2017-03-24T00:00:00.000
A57: 12 | B57: 10010 | C57: 2017-04-04T00:00:00.000
A58: 11 | B58: 10011 | C58: 2019-01-03T00:00:00.000
A59: 11 | B59: 10011 | C59: 2018-12-16T00:00:00.000
A60: 14 | B60: 10011 | C60: 2018-10-02T00:00:00.000
A61: 14 | B61: 10011 | C61: 2018-11-10T00:00:00.000
A62: 12 | B62: 10014 | C62: 2018-12-24T00:00:00.000
A63: 12 | B63: 10014 | C63: 2018-12-23T00:00:00.000
A64: 12 | B64: 10014 | C64: 2019-02-02T00:00:00.000
A65: 12 | B65: 10014 | C65: 2019-01-06T00:00:00.000
A66: 14 | B66: 10014 | C66: 2018-12-20T00:00:00.000
A67: 14 | B67: 10014 | C67: 2018-12-17T00:00:00.000
A68: 14 | B68: 10014 | C68: 2019-02-03T00:00:00.000
A69: 14 | B69: 10014 | C69: 2019-01-27T00:00:00.000
A70: 14 | B70: 10014 | C70: 2019-01-29T00:00:00.000
A71: 14 | B71: 10014 | C71: 2018-12-23T00:00:00.000
A72: 16 | B72: 10014 | C72: 2019-01-20T00:00:00.000
A73: 16 | B73: 10014 | C73: 2019-01-30T00:00:00.000
A74: 16 | B74: 10014 | C74: 2019-01-17T00:00:00.000
A75: 16 | B75: 10014 | C75: 2018-12-24T00:00:00.000
A76: 16 | B76: 10014 | C76: 2018-12-27T00:00:00.000
A77: 16 | B77: 10014 | C77: 2019-01-08T00:00:00.000
A78: 16 | B78: 10014 | C78: 2018-12-12T00:00:00.000
A79: 11 | B79: 10015 | C79: 2019-01-28T00:00:00.000
A80: 11 | B80: 10015 | C80: 2018-12-23T00:00:00.000
A81: 11 | B81: 10015 | C81: 2019-01-08T00:00:00.000
A82: 11 | B82: 10015 | C82: 2019-01-13T00:00:00.000
A83: 12 | B83: 10015 | C83: 2019-01-10T00:00:00.000
A84: 14 | B84: 10015 | C84: 2017-12-15T00:00:00.000
A85: 14 | B85: 10015 | C85: 2019-01-26T00:00:00.000
A86: 14 | B86: 10015 | C86: 2018-08-21T00:00:00.000
A87: 16 | B87: 10015 | C87: 2018-11-07T00:00:00.000
A88: 16 | B88: 10015 | C88: 2018-11-27T00:00:00.000
A89: 12 | B89: 10016 | C89: 2018-01-15T00:00:00.000
A90: 12 | B90: 10016 | C90: 2017-11-24T00:00:00.000
A91: 12 | B91: 10016 | C91: 2018-11-05T00:00:00.000
A92: 11 | B92: 10017 | C92: 2018-12-31T00:00:00.000
A93: 11 | B93: 10017 | C93: 2018-12-17T00:00:00.000
A94: 14 | B94: 10017 | C94: 2019-01-10T00:00:00.000
A95: 14 | B95: 10017 | C95: 2018-12-10T00:00:00.000
A96: 14 | B96: 10017 | C96: 2019-01-08T00:00:00.000
A97: 12 | B97: 10018 | C97: 2018-12-02T00:00:00.000
A98: 12 | B98: 10018 | C98: 2018-05-30T00:00:00.000
A99: 12 | B99: 10018 | C99: 2018-09-04T00:00:00.000
A100: 12 | B100: 10018 | C100: 2018-06-16T00:00:00.000
A101: 12 | B101: 10018 | C101: 2019-01-17T00:00:00.000
A102: 12 | B102: 10019 | C102: 2018-12-14T00:00:00.000
A103: 12 | B103: 10019 | C103: 2019-01-02T00:00:00.000
A104: 12 | B104: 10019 | C104: 2019-02-05T00:00:00.000
A105: 12 | B105: 10019 | C105: 2019-01-23T00:00:00.000
A106: 12 | B106: 10019 | C106: 2019-01-21T00:00:00.000
A107: 12 | B107: 10019 | C107: 2019-01-26T00:00:00.000
A108: 12 | B108: 10019 | C108: 2019-01-25T00:00:00.000
A109: 12 | B109: 10019 | C109: 2019-02-02T00:00:00.000
A110: 12 | B110: 10019 | C110: 2019-02-01T00:00:00.000
A111: 14 | B111: 10019 | C111: 2019-01-04T00:00:00.000
A112: 14 | B112: 10019 | C112: 2019-01-10T00:00:00.000
A113: 14 | B113: 10019 | C113: 2019-01-14T00:00:00.000
A114: 14 | B114: 10019 | C114: 2018-12-20T00:00:00.000
A115: 12 | B115: 10020 | C115: 2018-09-29T00:00:00.000
A116: 12 | B116: 10020 | C116: 2019-01-15T00:00:00.000
A117: 12 | B117: 10020 | C117: 2018-08-31T00:00:00.000
A118: 12 | B118: 10020 | C118: 2018-09-11T00:00:00.000
A119: 12 | B119: 10020 | C119: 2018-10-15T00:00:00.000
A120: 12 | B120: 10020 | C120: 2018-09-05T00:00:00.000
A121: 12 | B121: 10020 | C121: 2018-08-17T00:00:00.000
A122: 16 | B122: 10020 | C122: 2019-02-01T00:00:00.000
A123: 16 | B123: 10020 | C123: 2018-09-18T00:00:00.000
A124: 16 | B124: 10020 | C124: 2018-08-25T00:00:00.000
A125: 16 | B125: 10020 | C125: 2018-11-29T00:00:00.000
A126: 16 | B126: 10020 | C126: 2018-10-31T00:00:00.000
A127: 16 | B127: 10020 | C127: 2019-01-22T00:00:00.000

Sheet: PPGestionnaires
A1: NoGestionnaire | B1: AdresseEmail | C1: MotDePasse
A2: 1 | B2: admin | C2: Secret12345

Sheet: PPTaxeFederale
A1: NoTPS | B1: DateEffectiveTPS | C1: TauxTPS
A2: 1 | B2: 2001-01-01T00:00:00.000 | C2: 7
A3: 2 | B3: 2005-01-01T00:00:00.000 | C3: 6
A4: 3 | B4: 2008-01-01T00:00:00.000 | C4: 5

Sheet: PPTaxeProvinciale
A1: NoTVQ | B1: DateEffectiveTVQ | C1: TauxTVQ
A2: 1 | B2: 2005-01-01T00:00:00.000 | C2: 7.5
A3: 2 | B3: 2011-01-01T00:00:00.000 | C3: 8.5
A4: 3 | B4: 2012-01-01T00:00:00.000 | C4: 9.5
A5: 4 | B5: 2013-01-01T00:00:00.000 | C5: 9.9749999999999996

Sheet: PPTypesLivraisons
A1: CodeLivraison | B1: Description
A2: 1 | B2: Poste régulière
A3: 2 | B3: Poste prioritaire
A4: 3 | B4: Transport privé

Sheet: PPTypesPoids
A1: CodePoids | B1: PoidsMin | C1: PoidsMax
A2: 10 | B2: 0.1 | C2: 4.9000000000000004
A3: 20 | B3: 5 | C3: 19.899999999999999
A4: 30 | B4: 20 | C4: 99.9
A5: 40 | B5: 100 | C5: 999999.99

Sheet: PPPoidsLivraisons
A1: CodeLivraison | B1: CodePoids | C1: Tarif
A2: 1 | B2: 10 | C2: 4.5
A3: 1 | B3: 20 | C3: 12.5
A4: 1 | B4: 30 | C4: 25
A5: 1 | B5: 40 | C5: 35
A6: 2 | B6: 10 | C6: 6.75
A7: 2 | B7: 20 | C7: 15.75
A8: 2 | B8: 30 | C8: 29
A9: 2 | B9: 40 | C9: 45
A10: 3 | B10: 10 | C10: 15
A11: 3 | B11: 20 | C11: 20
A12: 3 | B12: 30 | C12: 35
A13: 3 | B13: 40 | C13: 50